prefix	input_text	target_text
other	PersonX reduces PersonX's costs	to plan for the future
other	PersonX makes chocolate chip cookies	to eat one of the cookies
other	PersonX loves PersonY well	to take the relationship to a new level
other	PersonX plays this game	to compare notes on the game
other	PersonX hides the ___ in PersonX's voice	worried
other	PersonX snaps it up	celebrate
other	PersonX mixes all the ingredients	knowledgeable
other	PersonX persuades PersonY to join	gets accepted
other	PersonX sits quietly in my coffee shops	to find out if PersonX needs anything else
other	PersonX has a bad cough	bad
other	PersonX goes on in PersonY's mind	preoccupied
other	PersonX hurts PersonY's leg	remorseful
other	PersonX works ___ at work	tired
other	PersonX finds PersonY's ___ into the hands	aware
other	PersonX takes a bath	gets wet
other	PersonX walks down the hall	get ready to walk
other	PersonX measures the ___ accurately	to survey an area
other	PersonX throws to the dogs	gets jumped on
other	PersonX hurts PersonY much	bad
other	PersonX pays PersonY's back	smiles
other	PersonX buys PersonY's own shoes	To get the payment
other	PersonX takes action against PersonY	aggressive
other	PersonX shows what PersonX is made of ___	to win
other	PersonX hurts really bad	the mother of person x comes
other	PersonX lets PersonY's sleep	To be near Y
other	PersonX sells PersonY's goods	to find a buyer
other	PersonX walks on stage	cautious
other	PersonX lets PersonY's head fall	to cut off PersonY's head
other	PersonX declares war on PersonY	lose everything
other	PersonX eats too many sweets	to like sweets
other	PersonX works as a cashier	see's them at their work
other	PersonX requires ___ on the part	attentive
other	PersonX opens PersonY's eyes	to make sure they get it
other	PersonX sees ___ in the kitchen	observant
other	PersonX goes to a party with PersonY's friends	travel home
other	PersonX hits the deer	He was driving down the road.
other	PersonX finds the perfect pair	try them on
other	PersonX carries out PersonX's purpose	excited to have done it.
other	PersonX receives a call	to talk with the person calling
other	PersonX plays ice hockey	wear warm and protective gear
other	PersonX gives PersonY a stare	He runs
other	PersonX comes home to roost	Is able to relax
other	PersonX discusses these ___ in detail	Learns something
other	PersonX might be pregnant	to find out the result of the test
other	PersonX writes a paper	Creative
other	PersonX gives PersonX's position	to call on the radio
other	PersonX gets a fix	remorse
other	PersonX performs one 's ___	fix whatever they did wrong
other	PersonX grabs PersonY's shoulder	aggressive
other	PersonX hires PersonY a tutor	is appreciative
other	PersonX is angry at PersonY's brother	confused
other	PersonX loses in the woods	They are informed that X is missing
other	PersonX gives PersonY's baby	loving
other	PersonX has a bad cough	scared of catching a cold
other	PersonX hits rock bottom	Stages Intervention
other	PersonX sees ___ on tv	laughs
other	PersonX seems right	praised
other	PersonX undergoes PersonY operation	helpfull in all ways
other	PersonX finds the problem	thankful
other	PersonX wants PersonY around	dependent
other	PersonX puts money	thrifty
other	PersonX contacts PersonX's friends	to charge the phone
other	PersonX loves PersonY dearly	to take PersonY on a trip
other	PersonX performs PersonY function	to ask the boss what goes on
other	PersonX gives PersonY increase	thanks Person X
other	PersonX whispers ___ in PersonY's ear	to have something to say
other	PersonX raises PersonY's hands	to walk to PersonY
other	PersonX resolves PersonY's problems	special.
other	PersonX keeps PersonX's nose clean	go to private place
other	PersonX brings ___ to the store	put away what was bought
other	PersonX saves PersonY's souls	grateful
other	PersonX revs PersonY's engine	interested
other	PersonX clears PersonY's head	focused
other	PersonX sweats the small stuff	to not want other people to be disappointed
other	PersonX is n't good enough	imperfect
other	PersonX offers a new job	to decide on a job candidate
other	PersonX assures PersonY would be	to take PersonX's word
other	PersonX also practiced	to work harder
other	PersonX executes ___ upon PersonY doeth evil	To win the battle
other	PersonX hits ___ in the face	Make them plead for mercy
other	PersonX puts oneself in PersonY's shoes	considerate
other	PersonX walks ___ to school	to bring his car to a garage.
other	PersonX spills PersonY's drink	sad
other	PersonX gets beat up	fight back
other	PersonX wants to be president	motivated
other	PersonX moves back in with PersonX's parents	crowded
other	PersonX wins the first game	proud
other	PersonX loves to sing	neutral
other	PersonX picks up what PersonY is putting down	gets locked up
other	PersonX tries to find PersonY	keep calling
other	PersonX eats it anyway	to pick up food
other	PersonX risks one 's ___	adventurous
other	PersonX becomes mad	the brunt of his anger
other	PersonX suits PersonY's needs	Used, possibly manipulated
other	PersonX comes to PersonY's rescue	To check on Y's health
other	PersonX releases PersonY's hold	Repectful
other	PersonX eats PersonY food	to lie about eating PersonY's food
other	PersonX hits PersonY in the head	injured
other	PersonX tilts PersonY's head slightly	to go near him
other	PersonX is n't feeling well	uncomfortable
other	PersonX wills help	wants to return a favor
other	PersonX wants to wake	energetic
other	PersonX studies enough	happy
other	PersonX makes ___ for everyone	hears people say, mmmm
other	PersonX makes PersonY sleepy	PersonY tells PersonX to go away
other	PersonX walks PersonY back	happy to have bee assisted.
other	PersonX hides ___ from PersonX's parents	upset
other	PersonX sits in PersonY's chair	good, that he can finally sit down
other	PersonX makes things right	forgiving
other	PersonX blows PersonX's engine	is able to drive again
other	PersonX pays the ticket	good
other	PersonX fixes PersonY's car	helpful
other	PersonX goes back to school	successful
other	PersonX takes ___ off road	gets low on gas
other	PersonX realizes it was saturday	aware
other	PersonX accidentally threw ___	enjoyment
other	PersonX feels guilty	depressed and confused
other	PersonX grabs PersonX's lunch	person x smells the lunch
other	PersonX says the wrong thing	unhappy
other	PersonX leaves PersonY's keys	Can be disappointed much
other	PersonX works great	He goes fast .
other	PersonX practices yoga	good
other	PersonX thrusts upon PersonY	loved
other	PersonX tells PersonX's parents what happened	to ask questions
other	PersonX writes PersonY's life	publish the person y's life
other	PersonX is expecting a baby	Becomes involved
other	PersonX avenges PersonX's father 's ___	gets a financial settlement
other	PersonX gives PersonY a way	to understand
other	PersonX steels PersonX's nerves	love
other	PersonX wants to make some money	for them to be a good employee
other	PersonX invites PersonX's girlfriend	aroused
other	PersonX makes ___ on the stove	eats the creation
other	PersonX sees PersonY in concert	PersonX buys a CD.
other	PersonX takes ___ in the future	consider the benefits
other	PersonX pays PersonY wages	good.
other	PersonX threatens every ___	to get rid of him
other	PersonX puts it in PersonY's mouth	to write down temperature
other	PersonX gets PersonY's wallet back	to display their gratitude to PersonX
other	PersonX drives PersonY to the hospital	be treated for their injury
other	PersonX takes the rest of the day	PersonX has to use their vacation time
other	PersonX is controlled by PersonY's subconscious	all knowing
other	PersonX does bad things	to ask for forgiveness
other	PersonX goes to PersonY's room	stand up
other	PersonX decides to adopt PersonY	relieved
other	PersonX leaves PersonX's wife	to apologize to PersonX
other	PersonX runs for exercise	increases endurance
other	PersonX puts PersonY in a vase	secretive
other	PersonX helps PersonY to PersonY's feet	strong
other	PersonX takes it out of the oven	hungry
other	PersonX almost lost ___	shaken up
other	PersonX covers PersonX's tracks	secretive
other	PersonX makes christmas cookies	fun
other	PersonX corners the market	to observe where the market is moving
other	PersonX volunteers PersonX's time	happy
other	PersonX guides PersonY even more forcefully	to lead the situation
other	PersonX cuts the cord	happy
other	PersonX completes PersonX's education	to study
other	PersonX makes a pizza	to wash up the dishes
other	PersonX reaches the earth 's ___	to orbit earth
other	PersonX knows what to say	to read books
other	PersonX plays games with PersonX's friends	competitive
other	PersonX forms PersonY association	helping
other	PersonX wants to dance	they sign them up for class
other	PersonX waves PersonY's arms	PersonY stares at PersonX in confusion
other	PersonX goes missing	look around
other	PersonX takes PersonY's son out	bad if the event went poorly
other	PersonX stays home and rest	sick
other	PersonX keeps it real	is genuine
other	PersonX puts PersonY in touch	to contact PersonY
other	PersonX gives you PersonY opportunity	to have fired PersonY
other	PersonX takes lots of photos	find a subject
other	PersonX tries PersonY's hardest	helpful
other	PersonX defies every ___	Daring
other	PersonX takes piano lessons	studious
other	PersonX loses 40 pounds	exercise
other	PersonX is really tired	lethargic
other	PersonX gets furious	Dangerous
other	PersonX eats the food	Makes a plate
other	PersonX needs more money	scared
other	PersonX thrusts PersonY's hips	to slap PersonX
other	PersonX transmutes ___ into gold	wizardly
other	PersonX lives PersonX's whole life	is honored by firends and family
other	PersonX breaks god 's ___	goes to jail
other	PersonX belongs to PersonY family	content
other	PersonX forgives PersonY's friend	Y's friend is validated
other	PersonX pays PersonY price	generous
other	PersonX catches many fish	to take it with a bit of skepticism
other	PersonX gives PersonY a headache	they gossip
other	PersonX takes PersonY to the emergency room	careful
other	PersonX is playing baseball	entertained
other	PersonX walks toward PersonY	social
other	PersonX teaches PersonY something	pay PersonX
other	PersonX buys some ice cream	to enjoy her ice cream
other	PersonX keeps PersonY around	to talk
other	PersonX keeps PersonY's mouth shut	to stay quiet
other	PersonX creates PersonY application	to know their talents
other	PersonX needs to get started	to have chores that need to be done
other	PersonX owes to PersonY's position	to prove to PersonY their decision was right
other	PersonX goes looking for PersonY	scared
other	PersonX gets into a car accident	person x calls insurance
other	PersonX becomes too much	frustrated
other	PersonX takes ___ to vegas	adventurous
other	PersonX dates PersonX's girlfriend	to know why he chose his girl
other	PersonX sees PersonY wars	looks for person y
other	PersonX takes PersonX's first bite	tastes food
other	PersonX tells people	go to a safer place
other	PersonX improves PersonX's game	happy
other	PersonX gratifies every ___	helpful
other	PersonX really enjoy ___	becomes addicted
other	PersonX is having a birthday party	to have cake
other	PersonX stands next	stand behind a person
other	PersonX explains the ___ on the basis	learn the difference on the basis
other	PersonX affects PersonY's lives	in control
other	PersonX lays hands on ___	to walk to the puppy
other	PersonX turns PersonY ___ away	changes location
other	PersonX puts it under PersonX's pillow	to be scared
other	PersonX ties together the ___	has completed something
other	PersonX enters PersonY's house	to travel.
other	PersonX goes hiking ___	healthy
other	PersonX pulls ___ firmly against PersonY's	Is swept up in dance.
other	PersonX unpacks PersonY's belongings	open it
other	PersonX kisses the gunners daughter	romantic
other	PersonX goes to PersonY's head	thank PersonX
other	PersonX lays PersonY's hands	to wonder what PersonX will do
other	PersonX warmly kissed PersonY's necked	has intercourse
other	PersonX buys PersonX's dress	to shop around
other	PersonX finds a new friend	grateful
other	PersonX gets lost in the woods	scared
other	PersonX decides to save up	gets a savings account
other	PersonX wants to help PersonY	to buy PersonY some coffee and donuts
other	PersonX walks to the kitchen	helpful
other	PersonX takes ___ on a date	to choose a date spot
other	PersonX describes ___ in terms	grateful
other	PersonX eats healthier	to stop being junk food
other	PersonX keeps PersonY going	to stimulate personY
other	PersonX sells PersonX's ___ dearly	to use the purchased item
other	PersonX drops PersonY's laptop	scared
other	PersonX tells PersonY love	to propose
other	PersonX races home	trips
other	PersonX moves to a new neighborhood	to save money
other	PersonX sends to PersonX's room	to lay down.
other	PersonX eats PersonY alive	is scared of PersonX
other	PersonX loves comic books	buys comic book subscription
other	PersonX comes pick PersonY up	grateful for x's time
other	PersonX eats good food	Well off
other	PersonX walks ___ from school	gets exercise
other	PersonX drives on the road	accomplished
other	PersonX condemns PersonY to death	freedom
other	PersonX learns to play the violin	to get a training program
other	PersonX leaks water	clumsy
other	PersonX finds a cheap one	cheap
other	PersonX orders another ___	to call a taxi
other	PersonX sleeps every night	fulfill the day
other	PersonX feels really ___	good
other	PersonX cries PersonY a river	to offer PersonX a tissue
other	PersonX sends umi a ___	smiles
other	PersonX goes to PersonY's office	He or she needs to get ready.
other	PersonX feels ill	take medicine
other	PersonX judges every ___ according	is feared
other	PersonX has a terrible headache	lays down
other	PersonX makes up PersonY mind	careness
other	PersonX regulates PersonX's conduct	dominant
other	PersonX finds ___ in the freezer	to open the freezer
other	PersonX defeats every ___	defeated
other	PersonX talks to a friend	shares information
other	PersonX asks PersonY on a date	to let x down gently
other	PersonX leaves PersonY's country	PersonY thinks about PersonX
other	PersonX gets it checked out	eats groceries
other	PersonX holds onto PersonY	good that they're being embraced.
other	PersonX resigns PersonX's position	gets compensation package
other	PersonX affords PersonY the opportunity	thankful
other	PersonX wreaks havoc	Punish PersonX for wreaking havoc
other	PersonX looks into PersonY eyes	confronts PersonY
other	PersonX is taken to the hospital	unwell
other	PersonX takes PersonY's son out	PersonY entrusts personX with his son
other	PersonX frightens ___ away	belligerent
other	PersonX keeps PersonY close	affectionate
other	PersonX plays baseball with PersonX's friends	Friends sweat
other	PersonX punches ___ in the face	Goes to the hospital
other	PersonX makes lots of friends	to make new friends too
other	PersonX arranges another ___	stringent
other	PersonX raises PersonY's kids	happy
other	PersonX has just moved to a new town	good about moving
other	PersonX makes believe	creative
other	PersonX lands right	to jump
other	PersonX pulls PersonY towards PersonY	cringes at personx's touch
other	PersonX always beats ___	to improve his game skills
other	PersonX picks flowers	enjoy nature
other	PersonX lays down next to PersonY	to enjoy the stars
other	PersonX sends ___ abroad	earn more money
other	PersonX goes swimming instead	free-spirited
other	PersonX goes ___ for one	becomes tired
other	PersonX hears footsteps	checks out the noise
other	PersonX loses PersonX's head	to regain control
other	PersonX drives ___ from work one	spend less money on transportation.
other	PersonX strikes PersonY in the face	to grab person x
other	PersonX suffers ___ gladly	gentle
other	PersonX resumes PersonX's seat	to say what they want to say
other	PersonX gives PersonX's candy	To tell them they're welcome
other	PersonX wins first place in the competition	to drink beer
other	PersonX robs the cradle	to fall in love
other	PersonX lies on the ground	safe
other	PersonX uses PersonY index	to get the index back
other	PersonX focuses on PersonX's job	achieves goals
other	PersonX becomes PersonY advocate	to pay PersonY for the defense
other	PersonX leaves the ___ behind	remembers
other	PersonX uses PersonY index	helpful
other	PersonX tenders PersonX's resignation	goes to new job
other	PersonX asks PersonY something	responds to question
other	PersonX would be ready	to learn from them
other	PersonX cashes PersonY's check	loses money
other	PersonX is scared and nervous	mouth agape on seeing Person X
other	PersonX feels very lonely	calls a friend
other	PersonX reduces PersonX's risk	to carefully understand the risk
other	PersonX makes PersonY's dream come true	to understand PersonY's dreams
other	PersonX goes home with PersonY	excited
other	PersonX prepares ___ for life	reflect on life
other	PersonX grabs PersonX's lunch	person x puts down the lunch
other	PersonX receives PersonY's reward	to get their award
other	PersonX follows in PersonY's footsteps	admired
other	PersonX describes accurately the ___	to see the photos
other	PersonX takes a math exam	attend class
other	PersonX buys a coffee	alert
other	PersonX can n't afford to fix it	strain to do
other	PersonX walks around the city	meets old friend
other	PersonX drinks ___ anyway	he gets sick
other	PersonX invites PersonY's boyfriend	kind
other	PersonX calls the electric company	to answer questions
other	PersonX makes ___ in school	is voted prom king
other	PersonX expresses ___ in terms	eager
other	PersonX keeps PersonY's promise	for personY to thank them
other	PersonX challenges PersonX's friends	to be better
other	PersonX listens to PersonY's mother	obedient
other	PersonX orders PersonY back	dominant
other	PersonX plays the slots	put money in
other	PersonX means a lot to PersonY	special to x.
other	PersonX breaks PersonY word	annoyed.
other	PersonX gives the devil his due	to get a raise
other	PersonX makes ___ on the stove	look up recipe
other	PersonX has a litter of puppies	to get a bunch of puppies
other	PersonX hurts another ___	mean
other	PersonX makes spaghetti	full
other	PersonX looks high and low	happy if he manages to find the thing.
other	PersonX helps paint the living room	to pick out more colors
other	PersonX takes advantage of PersonY	receives justification from personx
other	PersonX takes a look at it	Hesitant
other	PersonX takes PersonX's purse	keep it safe
other	PersonX drives through town	start the car
other	PersonX steals PersonY's wallet	make an escape plan
other	PersonX takes PersonX's dog to the dog park	dog smiles
other	PersonX gets PersonY ___ back	like x really cares
other	PersonX writes a paper for PersonX's english class	intelligent
other	PersonX leaves PersonX's toys	to play with them
other	PersonX smiles back	the girl gives her number
other	PersonX gets PersonY bearings	to help personY get to where they are going.
other	PersonX jumps through hoops	like he learned something
other	PersonX works to rule	to work harder
other	PersonX follows PersonY everywhere	has a restraining order taken out against them
other	PersonX stops bragging	humbled
other	PersonX ties PersonY's shoes	to learn the art of tying it
other	PersonX brings PersonY along	to thank personx
other	PersonX sends to jail	get bail
other	PersonX goes back to PersonY	friendly
other	PersonX makes a long story short	to learn something
other	PersonX makes the dough	intelligent
other	PersonX takes care of PersonY ___	set up a living space
other	PersonX makes a mental note	thoughtful
other	PersonX puts my arm around PersonY	Caring
other	PersonX gives PersonY's dog	calls the dog over
other	PersonX comes to PersonY's aid	falls in love
other	PersonX would be perfect	to help out
other	PersonX plays banjo	musically driven
other	PersonX finds a bird	to help the bird
other	PersonX builds ___ together	they learn from it
other	PersonX is playing monopoly	to try to win
other	PersonX asks PersonY advice	satisfied
other	PersonX sends PersonY to summer camp	to Collect things necessary for the camp
other	PersonX surprises PersonX's mother	to greet their mother
other	PersonX lets go of PersonY	to cut ties with PersonY
other	PersonX watches PersonY play	to play in the mud
other	PersonX has just gotten married	PersonX now has a spouse
other	PersonX asks PersonY if had seen	ineterested
other	PersonX buys a new gun	to sell an gun
other	PersonX tries men 's souls	tortured
other	PersonX watches a little tv	entertained
other	PersonX pulls PersonY into a hug	Smiles
other	PersonX enters a race	committed
other	PersonX quickly learned	dedicated
other	PersonX gives PersonX's daughter	to make daughter happy
other	PersonX shaves all of PersonX's hair off	to get a rzaor
other	PersonX provides PersonY information	to tell PersonX to change their identity
other	PersonX learns how to knit	to practice
other	PersonX keeps ___ away from PersonY	to know where PersonY is
other	PersonX gives PersonY a discount	happy
other	PersonX pisses PersonX's pants	to hold it in
other	PersonX decides to have a yard sale	finds lamp
other	PersonX starts toward the door	to leave
other	PersonX owes PersonY money	in debt
other	PersonX obtains PersonY's release	free
other	PersonX continues PersonX's education	becomes more qualified for work
other	PersonX gets PersonY's father	to have help loading their things
other	PersonX provides PersonY service	an entrepreneur
other	PersonX cries every night	dry face
other	PersonX stands with PersonY's back	lost balance
other	PersonX orders takeout	walks out of restaurant
other	PersonX exchanges insurance information	to take the info down
other	PersonX wins the lottery	to save the money
other	PersonX plays drums	rhythmic
other	PersonX becomes very depressed	to help him
other	PersonX bruises the serpent 's ___	scared
other	PersonX visits many stores	see's a lot of different things
other	PersonX confers ___ upon PersonY	Receives
other	PersonX comes early	disciplined
other	PersonX sends PersonY the books	friendly
other	PersonX always forgot	irresponsible
other	PersonX goes get PersonY	experienced
other	PersonX takes a tour	curious
other	PersonX borrows ___ to buy	to repay the money
other	PersonX takes to the cleaners	to pick up cleaned clothes
other	PersonX has a lot of friends	talk to each other
other	PersonX starts choking	unbreathable
other	PersonX puts ___ in the car	neutral
other	PersonX eats fried chicken	to throw away the leftovers
other	PersonX brings PersonY's ___ back	helpful
other	PersonX puts PersonY's ___ into words	grateful
other	PersonX takes ___ to bed	to rest
other	PersonX pays the ___ back	empowered
other	PersonX knocks PersonX down with a feather	pick themselves up
other	PersonX almost hit ___	want to avoid
other	PersonX takes care of PersonY ___	They have their floor cleaned
other	PersonX keeps it in PersonX's pants	is accepted socially
other	PersonX tells PersonY to get out	PersonY is thrown out
other	PersonX really want	obsessed
other	PersonX sets PersonY right	start doing their homework
other	PersonX bears these ___ in mind	get jobs done successfully
other	PersonX wants PersonX's kids	to take them with her
other	PersonX receives PersonX's diploma	thinks they've been lied too.
other	PersonX takes up PersonY's cross	guilt
other	PersonX knows PersonY ___ better	risky
other	PersonX slams on PersonX's brakes	to check the car
other	PersonX improves PersonX's performance	better overall.
other	PersonX sends PersonY a text message	receives a response
other	PersonX wears out PersonX's welcome	exasperating
other	PersonX manages PersonY's ___ in PersonY's way	have more free time
other	PersonX takes ___ every night	Content
other	PersonX erects within the jurisdiction	Law abiding
other	PersonX gets much better	full recovery
other	PersonX is proud of PersonX's accomplishment	to have worked very hard
other	PersonX cuts a figure	relieved
other	PersonX hides ___ from PersonX's parents	to avoid something with their parents
other	PersonX removes PersonY from office	superior
other	PersonX keeps PersonY's company	grateful
other	PersonX reaches ___ in length	gains height
other	PersonX plays ___ for hours	compulsive
other	PersonX fights a losing battle	gets defeated
other	PersonX takes care of PersonY's needs	to pay personX
other	PersonX buys ___ at prices	gets cheated
other	PersonX is a good worker	to get a promotion
other	PersonX drives back the ___	aggressive
other	PersonX puts PersonX's ___ into effect	Is oppessed
other	PersonX fires ___ on the spot	shocked
other	PersonX gets a lot of candy	to eat the candy
other	PersonX falls open	to get up
other	PersonX plays ___ on PersonX's phone	walks to a friends house
other	PersonX asks PersonY to take	to escape from him
other	PersonX brings PersonX's lunch	to ask his wife cook lunch for him
other	PersonX comes online	shopping
other	PersonX enters a poker tournament	to earn money
other	PersonX returns to work	complete his work
other	PersonX didnt say anything	careless
other	PersonX loves going to the park	try it out
other	PersonX sneaks up behind PersonY	amused
other	PersonX finishes school	gets conscripted
other	PersonX changes the ___ for better	PersonX makes the world a better place
other	PersonX takes ___ immediately	good reputation
other	PersonX floats away	wanting for mommy
other	PersonX uses PersonX's name	like they got away with something
other	PersonX gets PersonY's girlfriend	gets into argument
other	PersonX hires a trainer	glad to be employed
other	PersonX is drinking tea	quenched
other	PersonX puts PersonX's money where PersonX's mouth is	to believe something
other	PersonX goes back in time	to call her mom and be full of nostalgia together.
other	PersonX watches movies all night	To buy snacks
other	PersonX has a high fever	sick
other	PersonX does not want to go	troubled
other	PersonX makes spaghetti for dinner	refreshed
other	PersonX forms PersonY army	helpful
other	PersonX drinks a glass of milk	responsible
other	PersonX helps ___ in need	become grateful towards PersonX
