prefix	input_text	target_text
other	PersonX really needed ___	seek out needed item
other	PersonX is at the beach with friends	to go to a restaurant
other	PersonX grabs PersonY's bags	call the cops
other	PersonX joins the track team	to attend meets
other	PersonX takes PersonX's truck	runs out of gas
other	PersonX goes to the beach with PersonY's family	enjoyable
other	PersonX wants to improve PersonX's health	physically healthier.
other	PersonX searches for hours	they are sure they have done their best
other	PersonX runs late for school	to scold PersonX
other	PersonX comes ___ on leave	pack his belongings
other	PersonX loses PersonX's ___ for PersonY sake	grateful
other	PersonX waters PersonY's lawn	notices cut grass
other	PersonX stops going to the gym	buy home equipment
other	PersonX never wore ___	cowboy boots
other	PersonX calls roadside assistance	to be lost
other	PersonX meets society 's ___	pride
other	PersonX speaks PersonY language	impressed
other	PersonX conducts ___ to determine	to look at the paperwork
other	PersonX throws ___ to the winds	to prevent it from happening
other	PersonX pays PersonX's fees	to do the right thing
other	PersonX climbs the mountain	adventurous
other	PersonX does drugs	high
other	PersonX goes to the zoo with PersonX's family	see interesting things.
other	PersonX likes sports	To buy sports shoes
other	PersonX talks for PersonY hour	PersonX bonds with PersonY
other	PersonX takes a taxi	Gets lost
other	PersonX lands on the floor	Be standing or sitting on something on the floor
other	PersonX effects PersonY entrance	entrancing
other	PersonX is the best in the class	superior
other	PersonX makes PersonY's way out	hears outside noises
other	PersonX lets PersonY alone	bad, unsatisfied
other	PersonX has a best friend	to treat PersonX well
other	PersonX holds ___ in the church	assumes responsibility
other	PersonX gives PersonY PersonX's attention	closer to personx
other	PersonX makes money	determined
other	PersonX casts ___ into the water	TAKE A BOOK
other	PersonX straddles PersonY's hips	aroused.
other	PersonX seizes PersonY by the arm	break away
other	PersonX breaks PersonY's foot	in pain
other	PersonX mistakes PersonY's ___ for a hat	PersonY laughs
other	PersonX forgets oneself	loses experience
other	PersonX provides PersonY overview	person y thanks person x
other	PersonX always stayed	not like to go out
other	PersonX is too drunk to drive	gets arrested
other	PersonX knows how to use it	Watch them carefully.
other	PersonX walks to PersonX's desk	engaged
other	PersonX rises every ___	looks great
other	PersonX calls ___ last night	hangs up phone
other	PersonX treats PersonY with respect	respectful
other	PersonX flies out of the traps	get caught
other	PersonX receives ___ alone	to go to a hospital
other	PersonX checks into PersonY's hotel	pleased
other	PersonX buys a new home	furnishes the home
other	PersonX wins 1st place	to celebrate
other	PersonX talks to PersonY's husband	call PersonY's husband
other	PersonX makes lasagna	hungry
other	PersonX needs stitches	takes care of personX
other	PersonX walks in PersonY's house	to make plans
other	PersonX sees PersonY's doctor	happy
other	PersonX dreams last night	to think about the dream
other	PersonX kicks the tires	check for leaks
other	PersonX improves the patient 's ___	takes medicine
other	PersonX gets PersonY's lunch	thankful
other	PersonX goes to the animal shelter	Speak to PersonX about animals available for adoption
other	PersonX becomes very sad	TO FRANK
other	PersonX looks ___ up on the internet	to have an internet connection
other	PersonX reduces PersonY's risk	good
other	PersonX disposes towards PersonY	surprised
other	PersonX helps ___ in trouble	are saved by PersonX
other	PersonX takes the bus to work	happy
other	PersonX means much to PersonY	happy to have good relationship with x
other	PersonX becomes angry	punches someone
other	PersonX performs the heimlich maneuver	to go to the hospital
other	PersonX sees PersonY in person	to speak to PersonY
other	PersonX grows ___ in PersonX's backyard	Plant the seeds they need.
other	PersonX gets another flight	cancel his current flight
other	PersonX licks PersonX's wounds	careless
other	PersonX chases the ball	playful
other	PersonX answers the ___ well	competent
other	PersonX produces ___ for use	reaches out their hand into a folder
other	PersonX makes PersonY object	unsure
other	PersonX gives ___ water	gets thanked
other	PersonX pulls PersonY's leg	to ask PersonX how their leg is
other	PersonX gets sick of it	eats something he loves
other	PersonX gives PersonY the benefit	satisfied
other	PersonX washes one another 's ___	to clean them
other	PersonX finds PersonY's class	to talk to PersonX
other	PersonX reaches PersonX's goal	Runs every morning
other	PersonX wrecks PersonX's car	forced to walk from now on
other	PersonX flies PersonX's kite	gets sunburned
other	PersonX increases PersonX's profits	competent
other	PersonX loses some weight	They fit into their clothes better
other	PersonX meets ___ online	to have online account
other	PersonX introduces ___ to the class	to listen to PersonX
other	PersonX smacks PersonY's lips	their lip swells up
other	PersonX establishes PersonY organization	a sense of accomplishment
other	PersonX hears a noise outside	curious
other	PersonX keeps it secret	watches words carefully
other	PersonX extends the ___ to include	to try out for the play
other	PersonX fixes PersonY's roof	satified
other	PersonX lays ___ on the table	indifferent
other	PersonX looks hard at PersonY	to talk to him
other	PersonX makes PersonY estimate	to discuss it with him
other	PersonX keeps up with the joneses	to be better than the jonses
other	PersonX pays dividends	independent
other	PersonX wants to surprise PersonX's girlfriend	enjoy surprise
other	PersonX makes PersonY better	strong
other	PersonX crashes PersonY's bike	to apologize
other	PersonX sees PersonY article	smart
other	PersonX needs ___ for work	can't use the car then
other	PersonX maintains PersonX's independence	PersonX doesn't have to depend on others for support
other	PersonX kisses PersonY hard	have to make a choice
other	PersonX keeps a eye on PersonY	nervous
other	PersonX buys another one	regrets wasting money
other	PersonX gets PersonY's things together	person get protection for things
other	PersonX decorates for christmas	an appealing environment
other	PersonX cries for help	dependent
other	PersonX buys a new laptop	satisfied
other	PersonX boos ___ off the stage	leaves the stage
other	PersonX spills water	annoyed
other	PersonX sneaks behind PersonY	to scare them
other	PersonX releases PersonY's hold	to win the fight
other	PersonX calls PersonY's brother	to give some details
other	PersonX leads PersonX's team	authoritative
other	PersonX gives PersonY's husband ___	PersonY's husband receives the list
other	PersonX sends the ___ away	unhappy
other	PersonX issues PersonY order	beneath x.
other	PersonX treats PersonY with respect	respectful
other	PersonX points the finger	deny blame
other	PersonX sells PersonY's ___ for money	to thank PersonX
other	PersonX saves PersonX's father 's ___	get looked at by paramedics
other	PersonX gets a grip	shocked
other	PersonX plays a ___ in making	gets a raise
other	PersonX keeps ___ in PersonY's room	mischevious
other	PersonX removes PersonY from office	to tell PersonY they were not competent
other	PersonX pays off PersonX's debts	Freedom
other	PersonX struggles to make ends meet	to win the lottery
other	PersonX delivers up the ___ to god	God gets what was delivered.
other	PersonX raises ___ to PersonY's lips	makes Y withdraw
other	PersonX takes a lot of work	to make money
other	PersonX thinks might help	to use the idea
other	PersonX sees PersonY soon	good to see x
other	PersonX takes the dog home	warm
other	PersonX wins the spelling bee	excited
other	PersonX digs PersonY's fingers	She gets a foot massage.
other	PersonX takes up PersonY's residence	his documents back
other	PersonX wants to be healthy	goes on a diet
other	PersonX changes PersonX's pants	to dry and iron it
other	PersonX tries hard enough	struggling
other	PersonX starts PersonX's first job	to supervise PersonX
other	PersonX cools PersonX's heels	they're heels were touched by someone else
other	PersonX brings PersonY close	good
other	PersonX visits PersonY's mom	relieved
other	PersonX loses the race	wins the race
other	PersonX meets ___ at work	happy as well
other	PersonX comes to PersonY's aid	to hug person x for their help
other	PersonX gives PersonY rights	to do what they want
other	PersonX sees PersonY's works	ok
other	PersonX takes ___ to mcdonald 's	thankful
other	PersonX throws water	to throws water
other	PersonX is 20 years old	to indulge in something
other	PersonX wakes ___ up early	tiredness
other	PersonX protests PersonX's innocence	to hope for the best
other	PersonX decides to ask PersonY out	Gets jitters
other	PersonX grants PersonY permission	to enter the premises
other	PersonX wraps my arms around PersonY's neck	happy and loved.
other	PersonX gets home that night	relieved
other	PersonX is bored at home	to start a project
other	PersonX finds PersonY's mom	glad for seeing their mom
other	PersonX gets to know PersonY	social
other	PersonX brings ___ to light	satisfied
other	PersonX gets another	fulfilled
other	PersonX breastfeeds PersonX's baby	baby is full
other	PersonX catches ___ in the act	worried
other	PersonX delivers PersonY from evil	assisting
other	PersonX sends ___ to take	X gets results
other	PersonX breaks PersonY's phone	loses a phone
other	PersonX runs away from home	worried
other	PersonX comes in from the cold	gets warmed up
other	PersonX buys PersonY's supplies	to paint a picture.
other	PersonX irons PersonX's clothes	organized
other	PersonX reaches out PersonY's hand	to observe PersonX
other	PersonX likes PersonY very much	flattered
other	PersonX ensures PersonY's success	to express his gratitude
other	PersonX finds the perfect dog	kind
other	PersonX stills went	to arrive
other	PersonX expects a child	to care for PersonX
other	PersonX gives PersonY ___ back	relieved
other	PersonX climbs on top of PersonY	pushes away
other	PersonX drives home PersonX's ___	to gather teaching materials
other	PersonX gets PersonY's money 's ___	work
other	PersonX spends all of PersonY's money	to get some material goods
other	PersonX gives PersonY's dad	to have a tool
other	PersonX believes PersonY when say	Think about what they are saying.
other	PersonX tells the waitress	heard
other	PersonX meets new people	to judge/evaluate PersonX based on first impressions
other	PersonX transmits by PersonY means	pay bills
other	PersonX retires this week	happy
other	PersonX feels PersonY's heart	is told his heart rate is high
other	PersonX makes up PersonY's mind	PersonX is thanked
other	PersonX gets married a year later	to start a family
other	PersonX asks PersonY's parents	humble
other	PersonX hands in PersonX's dinner pail	grateful
other	PersonX performs PersonY's tasks	worried.
other	PersonX changes PersonY's name	think up new acceptable name
other	PersonX catches PersonY's breath	refreshed.
other	PersonX asks ___ for advice	curious
other	PersonX loves PersonX's mother	gets invited for dinner
other	PersonX inflicts upon PersonY	to smack PersonY
other	PersonX gives PersonY the pleasure	happy
other	PersonX shows PersonX's true colors	To distance themselves from X
other	PersonX fires the employee	Employee Yells
other	PersonX rocks PersonY's hips	playful
other	PersonX gives PersonY a job	to thank PersonX for the opportunity
other	PersonX performs PersonX's duties	hardworking
other	PersonX sits quietly	to get up and leave
other	PersonX keeps the puppy	happy
other	PersonX goes ___ at the mall	gets scammed
other	PersonX gets PersonX's car repaired	responsible
other	PersonX feels ___ on PersonY's shoulder	sweats
other	PersonX has a big test tomorrow	happy the test was good
other	PersonX tells PersonY to meet	to let PersonY know if they are available to meet.
other	PersonX seems nice enough	happy people like him
other	PersonX has ___ last night	sleepless
other	PersonX buys gifts for PersonY's family	surprised.
other	PersonX gives PersonY hopes	supported
other	PersonX gives PersonY a kiss	closes her eyes
other	PersonX finds a place	to rent the place
other	PersonX gives PersonY's girlfriend	to have a car
other	PersonX takes PersonY's share	to get help when they need it
other	PersonX looks for a new job	punch up their resume
other	PersonX meets PersonY wife	friendly
other	PersonX tells my mom	gets permission to go out
other	PersonX takes the ___ into consideration	to listen to all opinions carefully.
other	PersonX writes PersonY essay	Inhibits person y's development
other	PersonX heads outside	body temperature rises
other	PersonX never drank	to drink less too
other	PersonX puts ___ on the table	to eat their meal
other	PersonX feels awful	sighs in frustration
other	PersonX reaches for PersonY's phone	get a message
other	PersonX drives PersonY insane	annoyed
other	PersonX lets PersonY win	get the game out
other	PersonX forgets PersonX's phone	Misses calls
other	PersonX puts ___ in PersonY's mouth	fed
other	PersonX stands on PersonX's feet	betrayed
other	PersonX moves to a new area	Person X moves back
other	PersonX leaves PersonX's phone	to search for phone
other	PersonX forces upon PersonY	bad
other	PersonX uses steroids	to shoot it up
other	PersonX thinks might want	decides to make a purchase
other	PersonX looks delicious	stares at themselves in the mirror
other	PersonX declares PersonX's intention	gets something off their chest
other	PersonX gets ___ out of the garage	gets dusty
other	PersonX tells PersonY PersonY's name	smart
other	PersonX puts the ___ in order	delighted
other	PersonX has much fun	remembers that moment fondly
other	PersonX sees a homeless man	sad because he doesn't have a home or money
other	PersonX brings PersonY to the hospital	anxious
other	PersonX uses PersonY's laptop	To thank Y
other	PersonX takes ___ all day	to get on the bus
other	PersonX moves back	to take his position
other	PersonX becomes best friends	listens to person.
other	PersonX lifts PersonY's spirits	starts to smile to laud
other	PersonX accompanies PersonY far	happy
other	PersonX buys a burger	full
other	PersonX stops at the red light	satisfied
other	PersonX wants to run a marathon	get ready for marathon
other	PersonX brings the war to PersonY end	to defend
other	PersonX fulfills PersonX's obligations	to pay personX
other	PersonX receives ___ from others	to find a job
other	PersonX tells PersonY tales	to be entertained by PersonX
other	PersonX looks PersonY in the eyes	to be close
other	PersonX spills PersonX's drink	awkward
other	PersonX exposes the ___ to a number	know what the number is about
other	PersonX turns ___ into wine	drink wine
other	PersonX gets grounded	person x cant do anything
other	PersonX needs to get home	a car
other	PersonX rubs PersonY back	they feel relaxed
other	PersonX finds ___ to watch	flexible
other	PersonX leads PersonY existence	be independent
other	PersonX chips PersonX's tooth	to make an appointment to the dentist
other	PersonX opens a bottle of wine	happy
other	PersonX expresses PersonX's sympathy	Thanks him
other	PersonX finds ___ for PersonY's souls	to get rid of PersonY's demons
other	PersonX executes wrath upon PersonY doeth ___	becomes feared
other	PersonX treats PersonY differently	unfair
other	PersonX asks PersonY to meet	curious
other	PersonX enters upon a career	good determined
other	PersonX kills PersonY's father	mean
other	PersonX just listed PersonY for sale	enslaved
other	PersonX invites PersonY along	happy and gleeful
other	PersonX crosses PersonY's face	appealing
other	PersonX complies with PersonY's wishes	listens to person y
other	PersonX raises a lot of money	PersonX helps someone in need
other	PersonX locks PersonX's keys in PersonY's car	Kicks the car
other	PersonX serves PersonY's purposes	Thanks them
other	PersonX considers in detail the ___	Thinks of the best decision
other	PersonX solves PersonY problems	feels relief
other	PersonX becomes PersonY engineer	is regretful
other	PersonX packs PersonY's suitcase	becomes grateful toward X
other	PersonX develops ___ to help	happy
other	PersonX helps PersonY's family	offers to help in the future
other	PersonX tells PersonY to be quiet	concentrating
other	PersonX stays cool	remains relaxed
other	PersonX sees PersonY play	is active
other	PersonX holds the ___ in position	to lower the fluid level
other	PersonX picks it up right away	spots a quarter nearby
other	PersonX changes PersonY ___ with kings	to protest
other	PersonX evaluates ___ in terms	to gain access to the data
other	PersonX plays a ___ in the lives	better
other	PersonX finds ___ in PersonX's yard	seeking
other	PersonX has PersonX's first baby	dependent
other	PersonX has gone missing	bewildered
other	PersonX rubs PersonY's thumb	helpful
other	PersonX finds PersonY's phone	helpful
other	PersonX takes ___ to the city	adventurous
other	PersonX would not answer	nervous
other	PersonX seizes PersonY's hand	kissed
other	PersonX fails a test	to give PersonX a failing grade
other	PersonX hits another car	nervous
other	PersonX walks right	satisfied
other	PersonX issues PersonY edict	obedient
other	PersonX leaves and go home	to stop what they're doing
other	PersonX asks PersonY to dine	needy
other	PersonX gives ___ to PersonY's grandmother	loved
other	PersonX saves PersonY's country	valient
other	PersonX calls PersonX's husband	to take a message
other	PersonX drives downtown	get in the car
other	PersonX publishes PersonX's work	hardworking
other	PersonX sees PersonY cry	averts eyes with X
other	PersonX plays a ___ in the etiology	hurts
other	PersonX plays handball	Sweats
other	PersonX receives PersonX's education	studious
other	PersonX worships the ground PersonY walks on	important
other	PersonX lays down beside PersonY	calm
other	PersonX gives a great speech	inspired
other	PersonX grins from ear to ear	nice
other	PersonX likes the game	learn more about the game
other	PersonX is playing outside	to have fun
other	PersonX really likes PersonY	happy
other	PersonX entrusted to PersonY's care	responsible
other	PersonX gets some friends	happy
other	PersonX opens PersonY account	to receive help
other	PersonX becomes a better person	to marry a girl
other	PersonX provides ___ for PersonX's children	grateful
other	PersonX has to get rid of it	PersonX puts it on EBay
other	PersonX reconsiders PersonX's decision	enlightened
other	PersonX changes PersonX's views	to consider both views
other	PersonX goes well with PersonY	See PersonX
other	PersonX makes PersonY progress	do another activity
other	PersonX raises PersonX's standard	victorious
other	PersonX sets the ___ for the rest	to be admired
other	PersonX thanks ___ for the help	thankful
other	PersonX plays ___ on my friend	have fun at PersonY's expense
other	PersonX takes a shot in the dark	to have knowledge about topic.
other	PersonX votes for the first time	accomplished
other	PersonX gives ___ some medicine	could feel bad if they did not like person.
other	PersonX sends PersonY a text message	interested
other	PersonX explains in detail the ___	understoods well
other	PersonX carries away the ___	clean up
other	PersonX goes ___ for christmas	happy
other	PersonX calls out PersonY's name	to go on stage
other	PersonX affords PersonY opportunity	thankful
other	PersonX gives ___ a gift card	to thank person X
other	PersonX reads ___ in one	precocious
other	PersonX makes PersonY experiment	too ask personY for permission
other	PersonX learns PersonY's trade	empowered
other	PersonX takes ___ out to lunch	PersonX hang with friends
other	PersonX is going to the store	to buy things
other	PersonX sees an action movie	to buy a ticket
other	PersonX represents PersonY attempt	achieve goal
other	PersonX stills hurt	sympathetic to the pain
other	PersonX offer PersonY a ride	go home
other	PersonX says hi	Waits for a response
other	PersonX pushes PersonY on the ground	calls for help
other	PersonX puts ___ in PersonY's mouth	moves arm.
other	PersonX prevents the ___ from getting	be ready
other	PersonX plays it cool	safe
other	PersonX takes PersonY's two kids	to enjoy free time without children
other	PersonX always teased	mean
other	PersonX starts to grow	taller
other	PersonX marries soon	has child
other	PersonX invites everyone	appreciated
other	PersonX lives PersonY's life	to get back to their life
other	PersonX watches cartoons	childlike
other	PersonX goes surfing	to take a rest
other	PersonX gives PersonY the cold shoulder	apologizes
other	PersonX makes PersonY estimate	inquisitive
other	PersonX brings two together	to make the two get married
other	PersonX looks funny	call personX funny names
other	PersonX puts ___ on PersonY's desk	persony is able to continue with his work
other	PersonX risks one 's ___	Tries to drive
other	PersonX is extremely disappointed	depressed
other	PersonX demands all the money	scared
other	PersonX buys lunch	hungry
other	PersonX pushes PersonY around	to yell
other	PersonX produces PersonY impression	impression
other	PersonX saves PersonY the trouble	to help PersonY out
other	PersonX conducts ___ to determine	To publish results
other	PersonX is a bit nervous	to have a drink to settle their nerves
other	PersonX says hello	INFLUENCED
other	PersonX gives ___ a hug	kiss them
other	PersonX shovels snow	happy
other	PersonX adopts a baby	excited
other	PersonX drives PersonY to school	to thank PersonX
other	PersonX carries PersonY along	to be relocated
other	PersonX pieces ___ together	furrows brow in concentration
other	PersonX takes PersonY case	gets excited for personx taking and starts to scream
other	PersonX is going on a field trip	get a permission slip
other	PersonX pulls PersonY away	to be on his side
other	PersonX knows another ___	to assess what they should do
other	PersonX locks ___ out of the house	angry at themselves
other	PersonX gives PersonY a education	uses paper
other	PersonX studies for a test	stays up late
other	PersonX knows ___ personally	friendly
other	PersonX is driving PersonX's car	good.
other	PersonX divides the ___ into classes	princple
other	PersonX loses a lot of money	like a loser
other	PersonX gets a table	to have a nice dining area
other	PersonX loves motorcycles	learns more about motorcycles
other	PersonX deals with PersonX's problems	to thank X
other	PersonX needs someone	hear's personX
other	PersonX calls PersonY mother	talkative
other	PersonX gives it to PersonY's son	to thank PersonX
other	PersonX asks the question	wants them to learn
other	PersonX asks ___ for a date	flattered
other	PersonX loves PersonY anyway	to sigh in relief
other	PersonX talks for an hour	educated
other	PersonX makes PersonY order	to eat.
other	PersonX is my best friend	hangs out
other	PersonX gets robbed	careless
other	PersonX fulfils PersonY's mission	has more time to spare
other	PersonX places PersonY's hands	to look into PersonY's eyes
other	PersonX sees PersonY's name	hurt
other	PersonX asks my mom	is embarrassed
other	PersonX turns heads	to gawk at person x
other	PersonX calls the electric company	stressed
other	PersonX changes PersonY's plans	to enact the plan
other	PersonX buys apples	gives one apple to a homeless person
other	PersonX teaches PersonX's children	are attentive
other	PersonX makes fun of PersonY	run away
other	PersonX redoes PersonY's kitchen	accomplished
other	PersonX invites PersonY over for dinner	to eat the meal
other	PersonX purchases the ingredients	gets sick
other	PersonX refers the ___ to the court	set up an appointment with the court
other	PersonX brushes my teeth	gets thanked
other	PersonX allows PersonY to keep the dog	happy
other	PersonX goes for the gold	doesnt win
other	PersonX corners the market	successful
other	PersonX supports the government 's ___	for the government to help other things too
other	PersonX tries PersonY best	wishful
other	PersonX is working hard at PersonX's job	they learn to work hard
other	PersonX bares PersonX's soul	To be relieved
other	PersonX likes ___ so much	friendly
other	PersonX accomplishes PersonX's purposes	is regarded as a success
other	PersonX falls asleep at night	to have nice dreams.
other	PersonX wreaks havoc	to get revenge
other	PersonX takes PersonY to the hospital	dies
other	PersonX forgets to apply sunscreen	gets sunburn
other	PersonX shares PersonY's ___ with someone	wipe away tears
other	PersonX is PersonY's prom date	anxious
other	PersonX tells PersonY hoped	talkative
other	PersonX hears ___ on PersonX's door	casual
other	PersonX gathers around ___	roast marshmellows
other	PersonX keeps the ___ in repair	gets called hero
other	PersonX opens all PersonY's presents	segregate all presents
other	PersonX gives ___ a shot	playful
other	PersonX books PersonX's trip	traveled
other	PersonX makes breakfast for PersonX's family	content
other	PersonX keeps in touch with PersonY	learns more about persony
other	PersonX requires PersonY effort	hopeful
other	PersonX searches the entire house	to notice something is missing
other	PersonX uses PersonY instrument	be knowing use of instrument
other	PersonX uses PersonX's ___ to secure	to secure other things
other	PersonX fulfils one 's ___	to fulfill another dream
other	PersonX hides PersonX's light under a bushel	irritated
other	PersonX keeps PersonY in the dark	does not know
other	PersonX decides to buy a new car	to go to the dealer
other	PersonX makes PersonY impression	Study the way they do certain things.
other	PersonX puts ___ under PersonX's pillow	to wake up PersonX
other	PersonX kills PersonX's children	to live
other	PersonX is a happy couple	loved
other	PersonX passes PersonX's class	proud
other	PersonX places ___ in the way	people are impeded on the way
other	PersonX is the new kid in school	Shy away
other	PersonX wants a horse	to earn money to buy a horse
other	PersonX conducts PersonY experiment	waiting to see the result
other	PersonX views the ___ differently	could change laws.
