prefix	input_text	target_text
xIntent	PersonX builds a sand castle	entertained
xIntent	PersonX takes the day off	to rest.
xIntent	PersonX drives ___ from work one night	to go to bed
xIntent	PersonX bites the hand that feeds PersonX	the other person to feel threatened
xIntent	PersonX is studying for weeks	to be very learned in the subject
xIntent	PersonX speeds down the road	to go to the store
xIntent	PersonX asks ___ for advice	to get an opinion
xIntent	PersonX conducts ___ to determine	to know for sure
xIntent	PersonX has to get it fixed	it not to be broken anymore
xIntent	PersonX keeps PersonY still	to keep calm
xIntent	PersonX finds ___ in PersonY's house	to locate something missing
xIntent	PersonX takes ___ on a vacation	to have quality time with someone
xIntent	PersonX reads the directions	to be prepared
xIntent	PersonX wants ___ for christmas	a present
xIntent	PersonX plans a party	to get friends to come over
xIntent	PersonX leads the ___ away	to lead those to safety
xIntent	PersonX hides under PersonY's bed	to be silly
xIntent	PersonX sees PersonY's way	to be respectful
xIntent	PersonX builds a fence	to avoid the old fence injuring someone
xIntent	PersonX pays ___ to one	settle a debt
xIntent	PersonX makes ___ safely	to not get hurt
xIntent	PersonX joins the military	to serve their country
xIntent	PersonX brings PersonY forth	to show off
xIntent	PersonX folds ___ across PersonY's chest	let them know they are mad
xIntent	PersonX knocks PersonY off his perch	to avenge
xIntent	PersonX raises PersonX's kids	to be a father
xIntent	PersonX takes the lead	to win an event.
xIntent	PersonX will never see PersonY again	to not meet
xIntent	PersonX minds PersonX's own business	to do his/her work and don't wants to get in any trouble.
xIntent	PersonX is going to the store	to get clothes
xIntent	PersonX talks about PersonY's relationship	to be mean
xIntent	PersonX decides to leave	to be by himself
xIntent	PersonX studies for weeks	to pass a test
xIntent	PersonX cuts PersonX's grass	to mow the lawn
xIntent	PersonX gets a team together	to win
xIntent	PersonX is driving down the street	to get to the store
xIntent	PersonX follows another ___	to change the way they do things
xIntent	PersonX stops working	relief
xIntent	PersonX decides to go to the hospital	to get treated
xIntent	PersonX loses all PersonX's money	to gamble
xIntent	PersonX changes PersonX's dress	change person x's costumes
xIntent	PersonX picks a movie	to enjoy some entertainment
xIntent	PersonX pulls ___ to safety	to be helpful
xIntent	PersonX pays PersonY's bills	she whats someone to like her
xIntent	PersonX presses PersonY's mouth	to be controlling
xIntent	PersonX handles every ___	complete the job as required
xIntent	PersonX orders a steak	to have her lunch
xIntent	PersonX lets PersonY go	the man to be free
xIntent	PersonX gets groceries	to eat
xIntent	PersonX smells like PersonY	to let the person know he uses the same body wash.
xIntent	PersonX finally went to the doctor	to feel better
xIntent	PersonX stares PersonY in the face	angry
xIntent	PersonX knits a sweater	to make something
xIntent	PersonX reels the fish in	the fish
xIntent	PersonX shoots and killed	to get their target
xIntent	PersonX celebrates halloween	candy
xIntent	PersonX divides the ___ into regions	the person was like space
xIntent	PersonX makes ___ outside	to build something
xIntent	PersonX waves back	to be friendly
xIntent	PersonX takes ___ of changes	to finish the job
xIntent	PersonX flies to florida	to see her mom.
xIntent	PersonX goes to high school	to get a degree.
xIntent	PersonX has ___ eating contest	to eat food
xIntent	PersonX makes ___ back home	control
xIntent	PersonX expresses PersonX's thoughts	to inform others
xIntent	PersonX sighs in relief	to relax
xIntent	PersonX loses all the weight	to be healthier
xIntent	PersonX takes part in PersonY	to show support
xIntent	PersonX teaches PersonX's dog	they want the dog to behave
xIntent	PersonX asks what PersonY wanted	to understand
xIntent	PersonX puts PersonX's ___ into effect	to be in charge
xIntent	PersonX heads back home	to be somewhere familiar
xIntent	PersonX asks ___ to lunch	to be kind
xIntent	PersonX bruises the serpent 's ___	to stop the serpent from hurting them
xIntent	PersonX wants to go to bed	to sleep
xIntent	PersonX asks PersonY to return	wants the company of persony
xIntent	PersonX takes the trash	to get rid of unwanted things
xIntent	PersonX takes ___ two days	to get better
xIntent	PersonX ends PersonX's career	to do what they want to do
xIntent	PersonX gathers together the ___	to hold a meeting
xIntent	PersonX plays a ___ in the formation	to be together with others
xIntent	PersonX sells PersonY's goods	earn
xIntent	PersonX goes to the ice cream shop	to get refreshment
xIntent	PersonX carries PersonX's ___ into effect	to be nice
xIntent	PersonX gets PersonX's diploma	to graduate
xIntent	PersonX helps PersonY sleep	to stay relaxed
xIntent	PersonX drives to the store	to get food
xIntent	PersonX slaps PersonY on the back	to get into a fight
xIntent	PersonX protests PersonY's innocence	justice to be done
xIntent	PersonX does everything right	to be perfect
xIntent	PersonX determines the patient 's ___	to discharge him from hospital
xIntent	PersonX spends ___ learning	to graduate
xIntent	PersonX runs towards PersonY	to hugs the person.
xIntent	PersonX wants to make some money	to buy a new computer
xIntent	PersonX takes a math exam	to learn something
xIntent	PersonX represents PersonX's interests	to be represented
xIntent	PersonX uses the ___ to make	to make their life easier
xIntent	PersonX gets home	to feel comfortable
xIntent	PersonX keeps PersonY afloat	to care for them
xIntent	PersonX performs ___ using	do their job
xIntent	PersonX spots check	to make sure the answers are correct
xIntent	PersonX finally finished it	to complete a project
xIntent	PersonX learns to play the guitar	to make music
xIntent	PersonX tears open	to see what is inside
xIntent	PersonX watches the olympics	see who wins
xIntent	PersonX thinks might go	to go somewhere
xIntent	PersonX raises PersonY hand	to be funny
xIntent	PersonX sees PersonY tomorrow	to hang out
xIntent	PersonX buys some new clothes	to get rid of old ones
xIntent	PersonX takes PersonY to get	to get something
xIntent	PersonX walks to PersonX's desk	to get some work done
xIntent	PersonX spends more time	to be careful.
xIntent	PersonX learns how to play guitar	play an instrument
xIntent	PersonX invites back	to receive someone as his wish
xIntent	PersonX eats PersonY apple	to not be hungry
xIntent	PersonX grabs PersonY's head	to be aggressive
xIntent	PersonX watches the video	to relax
xIntent	PersonX gets the word out	people to be informed
xIntent	PersonX walks down the street	to meet someone
xIntent	PersonX commits PersonY offence	to get money
xIntent	PersonX takes PersonX's date	to enjoy themselves
xIntent	PersonX brings an umbrella	to be prepared for rain
xIntent	PersonX uses PersonX's knowledge	apply what he knows to something.
xIntent	PersonX comes toward PersonY	to talk to person
xIntent	PersonX talks PersonX's way	to be different
xIntent	PersonX takes baths	to get clean
xIntent	PersonX buys ___ for PersonX's family	to show appreciation
xIntent	PersonX sees could get	take something
xIntent	PersonX buries PersonX's head in the sand	to not believe something bad
xIntent	PersonX saves PersonX's country	protect people
xIntent	PersonX pisses and moan	to express emotion
xIntent	PersonX rolls PersonY's eyes at PersonY	to show annoyance
xIntent	PersonX meets PersonX's boyfriend 's parents	to meet them
xIntent	PersonX asks ___ to lunch	to make a new friend
xIntent	PersonX rides my bike	to play around
xIntent	PersonX makes a killing	to make money
xIntent	PersonX is on a first date	to have a nice time
xIntent	PersonX returns to PersonY's land	stay in that land
xIntent	PersonX would not come out	to avoid others
xIntent	PersonX practices every single day	to get better
xIntent	PersonX takes a job	money
xIntent	PersonX follows the directions	to be correct
xIntent	PersonX wins ___ back	to retain
xIntent	PersonX keeps ___ for a long time	to enjoy the object
xIntent	PersonX spends ___ with PersonX's children	to be a good caregiver
xIntent	PersonX attains PersonX's end	to achieve an accomplishment
xIntent	PersonX cramps PersonY's style	to interfere with persony
xIntent	PersonX pays ___ back	to be relieved of debt
xIntent	PersonX makes PersonY plans	to be in charge
xIntent	PersonX heads toward PersonY	to be closer
xIntent	PersonX decides to go on a hike	to exercise
xIntent	PersonX fills ___ with gas	to get where they are going
xIntent	PersonX ruffles PersonY's feathers	to annoy
xIntent	PersonX writes PersonY answer	to share knowledge
xIntent	PersonX convinces PersonY would be	them to know they are good at it
xIntent	PersonX is at the store with PersonY's mom	to do some shopping
xIntent	PersonX presses charges	protect themselves
xIntent	PersonX swims in the ocean	to have fun
xIntent	PersonX leaves the next day	happy
xIntent	PersonX knows could make	to establish his confidence
xIntent	PersonX throws a party	to celebrate.
xIntent	PersonX is walking through the park	to enjoy the scenery.
xIntent	PersonX looks at PersonY's wife	love
xIntent	PersonX points the finger	to blame someone
xIntent	PersonX fills PersonY's shoes	wants to understand.
xIntent	PersonX evens told PersonY	to let person know the information
xIntent	PersonX wants a pet	to guard the house
xIntent	PersonX is loud and annoying	to bother older sister
xIntent	PersonX rules the day	to be professional
xIntent	PersonX returns the shoes	to get their money back
xIntent	PersonX has a great time at the party	to be sociable
xIntent	PersonX tries something new	to have a new experience
xIntent	PersonX gets PersonX's ___ back	to be live with son
xIntent	PersonX sits opposite PersonY	to know person
xIntent	PersonX sees the lions	to be happy
xIntent	PersonX decides to have a yard sale	money
xIntent	PersonX lives by the ocean	to be close to nature
xIntent	PersonX makes it	to succeed in life
xIntent	PersonX takes photos	to be creative
xIntent	PersonX requires PersonY's attention	because persony is distracted
xIntent	PersonX takes advantage of the PersonY	to be better
xIntent	PersonX wanders the streets	to find someone
xIntent	PersonX hurts PersonY's leg	to intentionally hurt person y
xIntent	PersonX visits ___ one day	to catch up with a friend
xIntent	PersonX sends PersonX's ___ into the world	nan
xIntent	PersonX teaches PersonY's dog	to impress persony
xIntent	PersonX cooks ___ for dinner	to practice cooking
xIntent	PersonX is making dinner	to eat his late afternoon meal
xIntent	PersonX makes a nice dinner	eat a delicious meal.
xIntent	PersonX sings PersonX's praises	to brag a bit
xIntent	PersonX quickly called ___	to contact someone
xIntent	PersonX calls PersonY's back	to talk with someone
xIntent	PersonX returns PersonY's gaze	to get person's attention
xIntent	PersonX keeps it a secret	to ensure the trust
xIntent	PersonX loves sports	to be a sportsman
xIntent	PersonX sets a new record	he wants to be the best
xIntent	PersonX takes PersonX's vacation	to spend some time with their spouse and kids
xIntent	PersonX evens made ___	to impress people
xIntent	PersonX sticks in the snow	to play in the snow
xIntent	PersonX gets shots	to product self from disease
xIntent	PersonX orders the book	to buy a gift
xIntent	PersonX turns back around	to get to the proper destination
xIntent	PersonX studies for a test	to do well
xIntent	PersonX climbs the stairs	to go upstairs
xIntent	PersonX feels guilty about it	to make amends
xIntent	PersonX kills PersonY's brother	to be evil
xIntent	PersonX invests PersonX's money	to get the most out of their finances
xIntent	PersonX calls a friend	to socialize with their friend
xIntent	PersonX walks to PersonY's house	to say hello.
xIntent	PersonX loves playing basketball	play for fun
xIntent	PersonX asks PersonX's brother	to find something out
xIntent	PersonX announces PersonY's intention	to uncover motives
xIntent	PersonX hits my head	to be funny
xIntent	PersonX buys bottled water	to drink water.
xIntent	PersonX gets PersonX's gun	get the gun
xIntent	PersonX sells ___ to a friend	money
xIntent	PersonX measures ___ in diameter	to determine
xIntent	PersonX decides to try it out	to be daring
xIntent	PersonX takes PersonY to disney world	to do something nice
xIntent	PersonX pays ___ back	to be trustworthy
xIntent	PersonX wastes food	to get out of eating the food
xIntent	PersonX goes to the nurse 's office	to get something for a headache
xIntent	PersonX calls the cops	to stop a crime
xIntent	PersonX goes south	to travel
xIntent	PersonX goes back to the room	to be in their room.
xIntent	PersonX is really excited	to eat food
xIntent	PersonX loses all the weight	to be thin
xIntent	PersonX takes PersonY's orders	to serve
xIntent	PersonX holds PersonY's feet to the fire	to feel dominant.
xIntent	PersonX gives PersonY things	someone to have something
xIntent	PersonX always followed ___	to be a good role model
xIntent	PersonX heads back to the car	to go home
xIntent	PersonX ruins PersonY's life	person to have a bad life
xIntent	PersonX loves to play basketball	enjoys leisure and fun time
xIntent	PersonX licks PersonX's face	to be annoying
xIntent	PersonX graduates school	to be successful
xIntent	PersonX calls PersonX's neighbor	to ask if she can watch the house
xIntent	PersonX burns PersonX's bridges	to move on
xIntent	PersonX gives PersonX's consent	let someone do something
xIntent	PersonX takes the fifth	to remain quiet
xIntent	PersonX faces PersonY's fears	challenge himself
xIntent	PersonX traces PersonY's ___ back	to understand persony's roots
xIntent	PersonX takes PersonY's hand in PersonZ's	join hands with others
xIntent	PersonX works full time	to make money,
xIntent	PersonX throws it in the trash	to recycle
xIntent	PersonX invites ___ along	to be accompanied
xIntent	PersonX invites ___ over for dinner	have company
xIntent	PersonX buys a new hat	to look handsome
xIntent	PersonX takes care of PersonY's needs	to be considerate
xIntent	PersonX plays ___ that night	to get good at basketball
xIntent	PersonX kills PersonY's brother	to get revenge
xIntent	PersonX hides PersonX's face in PersonX's hands	to express frustration
xIntent	PersonX puts PersonY to shame	to take his position
xIntent	PersonX gives PersonY pain	to be mean
xIntent	PersonX is drunk at the bar	to celebrate
xIntent	PersonX itches the ditch	be sexually satisfied
xIntent	PersonX plants a garden in PersonX's backyard	to have flowers
xIntent	PersonX is more careful in the future	to stay safe
xIntent	PersonX watches ___ from the bench	to see the team win
xIntent	PersonX delivers the next day	delivers next day
xIntent	PersonX supports PersonY's families	to help
xIntent	PersonX moves PersonY's legs	to make room for himself
xIntent	PersonX shows a clean pair of heels	to leave quickly
xIntent	PersonX takes ___ to arrive	to take time
xIntent	PersonX needs ice	to cool a drink down
xIntent	PersonX plays a ___ in politics	to build the areas in social postingq
xIntent	PersonX distinguishes ___ from reality	a realist
xIntent	PersonX stays ___ with PersonY's children	to babysit
xIntent	PersonX ends PersonX's trip	to do something else
xIntent	PersonX braids PersonY's hair	to be helpful
xIntent	PersonX proves every ___	to be detail oriented
xIntent	PersonX gets some help	to do better
xIntent	PersonX puts PersonY's foot down	to be controlling
xIntent	PersonX brags to all PersonX's friends	to make people jealous
xIntent	PersonX changes PersonX's tire	to be able to drive their car
xIntent	PersonX digs up dirt	to dig a big hole.
xIntent	PersonX invests the money	to accomulate money
xIntent	PersonX cleans PersonY's garage	to help persony.
xIntent	PersonX does PersonY's math homework	to save persony time
xIntent	PersonX gets PersonY's keys	to leave the party
xIntent	PersonX restores the ___ to health	the body to health condition was bad
xIntent	PersonX buys an ice cream cone	to satisfy hunger
xIntent	PersonX heads to school	to be there on time
xIntent	PersonX picks PersonY's brain	to know some information
xIntent	PersonX walks ___ to school	to get exercise
xIntent	PersonX starts fifth grade	to learn more
xIntent	PersonX plays games on it	competition
xIntent	PersonX invites PersonX's boyfriend	to spend time with someone
xIntent	PersonX adds ___ to the fire	to keep the fire going
xIntent	PersonX makes ___ anyway	something to get done
xIntent	PersonX is PersonY's prom date	to attend prom
xIntent	PersonX decides to buy a lottery ticket	to win the jackpot.
xIntent	PersonX fires from PersonY's job	to get rid of employee
xIntent	PersonX checks PersonY's pockets	to take something that isn't theirs
xIntent	PersonX changes PersonY's policy	to be in control
xIntent	PersonX gets a team together	to win the game/activity
xIntent	PersonX takes karate lessons	to learn it
xIntent	PersonX takes my friend	to choose me the perfect gift
xIntent	PersonX takes PersonY's girlfriend	a relationship
xIntent	PersonX kills one 's ___	to be a murderer
xIntent	PersonX gets a loan	to be able to pay for things
xIntent	PersonX makes PersonY's move	to in that space
xIntent	PersonX tells PersonX's parents what happened	to come clean
xIntent	PersonX completes PersonX's course	to achieve an accomplishment
xIntent	PersonX minds PersonY business	to poke his nose
xIntent	PersonX plays every day	to shirk responsibilities
xIntent	PersonX thinks might want	to be think
xIntent	PersonX gets it back	the amount in time
xIntent	PersonX goes back to the house	be with family
xIntent	PersonX helps PersonY's team	they want to be helpful
xIntent	PersonX takes ___ to disneyland	to show someone a good time
xIntent	PersonX is working all day	to make money
xIntent	PersonX has a great time at the concert	to have a great time
xIntent	PersonX drinks PersonY's blood	to kill somebody
xIntent	PersonX rides PersonY's bike	to ride the bike
xIntent	PersonX finds ___ in life	enjoy life
xIntent	PersonX causes ___ in animals	to be cruel to other creatures.
xIntent	PersonX puts ___ in bags	to donate
xIntent	PersonX donates the money	to help the children
xIntent	PersonX tosses ___ back	to play the game
xIntent	PersonX sees PersonY back	to saw something
xIntent	PersonX swerves to avoid it	avoid hitting it
xIntent	PersonX reads the directions	start a project
xIntent	PersonX chases the ball	to continue playing
xIntent	PersonX takes part in the campaign	to promote a cause
xIntent	PersonX beats PersonY's personal record	they were driven by competition
xIntent	PersonX leads PersonY's team	be the leader of persony's team
xIntent	PersonX stops to help PersonY	to be helpful.
xIntent	PersonX calls ___ later	to get back in touch
xIntent	PersonX wipes the ___ from PersonX's brow	to be helpful
xIntent	PersonX goes out on a limb	to solve the problem.
xIntent	PersonX smells good	to attract people
xIntent	PersonX applies for a job	employment
xIntent	PersonX gets all PersonY's friends together	to celebrate
xIntent	PersonX left ___ ago	to go
xIntent	PersonX gets certified	to sell something
xIntent	PersonX plays bingo	to win money
xIntent	PersonX smells very bad	to insult others.
xIntent	PersonX utilizes every ___	to improve
xIntent	PersonX sends money	to help them
xIntent	PersonX jumps the queue	to cut in line.
xIntent	PersonX keeps looking	to know what's going on
xIntent	PersonX goes without PersonY	to show the way
xIntent	PersonX walks PersonX's dogs	to be nice
xIntent	PersonX gets a new puppy ___	to have a puppy
xIntent	PersonX determines PersonY's customer base	to be controlling
xIntent	PersonX makes my way back	get home
xIntent	PersonX finishes PersonY's essay	to help someone
xIntent	PersonX decorates PersonX's house for	to show off
xIntent	PersonX is going to work	to make a living
xIntent	PersonX supplies PersonX's wants	a particular thing
xIntent	PersonX braves every ___	expectant for the ball back
xIntent	PersonX supplies every ___	to provide assistance
xIntent	PersonX is playing a game	to have fun.
xIntent	PersonX drives PersonX's car on the highway	to arrive quicker
xIntent	PersonX sees PersonY in the morning	to see them at that time
xIntent	PersonX makes fun of PersonY's	to make the person feel bad
xIntent	PersonX loves PersonX's new home	a nice home
xIntent	PersonX follows PersonY's home	to make sure they get home safe
xIntent	PersonX announces to everyone	to inform as many people as possible
xIntent	PersonX improves the patient 's ___	to help
xIntent	PersonX wages PersonY war	to serve his country
xIntent	PersonX gives PersonY instructions	to instruct
xIntent	PersonX lets PersonX's dog out	their dog to go to the bathroom
xIntent	PersonX dies a martyr 's ___	they was meeting a death
xIntent	PersonX is having a birthday party	to celebrate with friends.
xIntent	PersonX grows vegetables	to maintain a garden
xIntent	PersonX decides to go on a date	to feel less alone
xIntent	PersonX wants to be in the school play	exposure
xIntent	PersonX fights fires	to protect people
xIntent	PersonX quickly turned around	to tell his friend to come to his house for dinner.
xIntent	PersonX hides the ___ in PersonX's voice	to be courteous
xIntent	PersonX finds PersonY place	to enquiry
xIntent	PersonX eats vegetables	to satisfy his hunger
xIntent	PersonX plays ___ often	to get better at the guitar
xIntent	PersonX gets plastic surgery	to look better
xIntent	PersonX apologizes profusely	to show how sorry they are
xIntent	PersonX falls within the scope	to make it through
xIntent	PersonX enjoys the music	to hear nice music
xIntent	PersonX sends PersonY to PersonZ's room	to manage others
xIntent	PersonX sells PersonX's ___ in the market	to be a good worker
xIntent	PersonX gets another one	to catch the most fish
xIntent	PersonX gives PersonY training	to help person y get healthy
xIntent	PersonX gets married in PersonY	to live forever with that person
xIntent	PersonX asks PersonY's son	to know the answer
xIntent	PersonX starts ___ next week	to be smarter
xIntent	PersonX finds ___ in the world	expect good world
xIntent	PersonX notices ___ in the water	to be observant
xIntent	PersonX presses ___ to PersonY's lips	to show affection
xIntent	PersonX tells PersonX's tale	to be understood
xIntent	PersonX practices every day	to get better at playing the piano
xIntent	PersonX is the best ever	to be better than everyone else
xIntent	PersonX meets a handsome man	to feel accomplished
xIntent	PersonX greets PersonY at the door	to welcome y to his/her house
xIntent	PersonX learns to play the drums	to make music
xIntent	PersonX yanks PersonY's chain	to be a jokester.
xIntent	PersonX treats ___ to dinner	to show appreciation
xIntent	PersonX eats PersonY apple	to be satiated
xIntent	PersonX stops the bleeding	to live
xIntent	PersonX gives PersonY a refund	to help persony
xIntent	PersonX carries out PersonY's functions	to be selfless.
xIntent	PersonX meets the country 's ___	to help the country to succeed
xIntent	PersonX asks PersonY what was wrong	to comfort
xIntent	PersonX takes a train ride	to travel
xIntent	PersonX invites friends over	to have company
xIntent	PersonX watches movies	entertainment
xIntent	PersonX causes PersonY trouble	to be trouble
xIntent	PersonX contributes to PersonY's understanding	help person y.
xIntent	PersonX decides to take a chance	to do well
xIntent	PersonX eats the cake	to enjoy food
xIntent	PersonX searches for something	to find it
xIntent	PersonX loves PersonX's ___ dearly	to show his love and affection
xIntent	PersonX satisfies PersonX's desires	to indulge themselves
xIntent	PersonX shops at the grocery store	to get something
xIntent	PersonX leaves the kitchen	to be out of the kitchen
xIntent	PersonX pours cold water on ___	in control
xIntent	PersonX decides to start taking lessons	to improve
xIntent	PersonX goes ___ in the ocean	to enjoy the water
xIntent	PersonX buys tickets to a concert	to saw the show
xIntent	PersonX causes ___ to others	others to feel for what they've done
xIntent	PersonX rides PersonX's horse	to enjoy himself
xIntent	PersonX lifts weights ___	to become strong
xIntent	PersonX writes a letter to PersonY	to give persony some news
xIntent	PersonX offers PersonY a position	to hire someone
xIntent	PersonX quits PersonX's old job	to move on to a new job
xIntent	PersonX ends the relationship	to be alone
xIntent	PersonX attains PersonX's object	he wants it
xIntent	PersonX tells PersonY the story	to be honest
xIntent	PersonX prevents ___ from spreading	protect
xIntent	PersonX does PersonY's work well	persony to be impressed by his job well done.
xIntent	PersonX gets separated	to go some other way
xIntent	PersonX gives PersonX's daughter	share her food
xIntent	PersonX blows PersonY out of the water	to save them
xIntent	PersonX kicks ___ away	to get rid of it
xIntent	PersonX cooks ___ at home	to make something interesting
xIntent	PersonX loses a lot of money	to gamble
xIntent	PersonX checks PersonX's bank account	to manage his account
xIntent	PersonX takes the dog home	to help it
xIntent	PersonX sees PersonY's doctor	medical advice
xIntent	PersonX satisfies man 's ___	needs
xIntent	PersonX takes ___ home	to be kind and make sure person gets home safely
xIntent	PersonX takes ___ in the year	to get control
xIntent	PersonX visits ___ last week	to catch up with them
xIntent	PersonX celebrates the lord 's ___	to show respect to the lord
xIntent	PersonX continues PersonY's course	to persevere
xIntent	PersonX invites friends	to be with companions
xIntent	PersonX sings PersonX's songs	praise
xIntent	PersonX has a stab	to solve a problem.
xIntent	PersonX gets PersonY's number	to get number
xIntent	PersonX chooses PersonX's ___ carefully	to be careful
xIntent	PersonX unpacks PersonX's things	to get organized
xIntent	PersonX books a hotel	to spend his vacation
xIntent	PersonX rolls down the window	to get cooler temperature.
xIntent	PersonX spends the evening with PersonY	to have fun
xIntent	PersonX passes PersonY act	the person good man
