prefix	input_text	target_text
oReact	PersonX waits PersonY hour	sorry
oReact	PersonX breaks my foot	threatened
oReact	PersonX swings hard	watchful
oReact	PersonX breaks my arm	upset
oReact	PersonX gives PersonY a kick	also angry.
oReact	PersonX descends upon PersonY	weak.
oReact	PersonX keeps PersonY under control	confined
oReact	PersonX goes viral	interested
oReact	PersonX loves PersonY unconditionally	loved
oReact	PersonX bears PersonY resemblance	okay
oReact	PersonX treats ___ in patients	healthy
oReact	PersonX hires PersonY a tutor	thankful
oReact	PersonX covers PersonY's shift	grateful
oReact	PersonX gets married	ecstatci
oReact	PersonX has dinner together	happy
oReact	PersonX stops to help PersonY	relieved.
oReact	PersonX goes to a friend 's house	excited
oReact	PersonX buys PersonY's flowers	grateful
oReact	PersonX is playing basketball with PersonY's friends	ssatisfied
oReact	PersonX pulls the ___ together	happy to have such a strong unit
oReact	PersonX wants to leave PersonY	sad
oReact	PersonX helps paint the living room	grateful
oReact	PersonX evens caught ___	happy
oReact	PersonX decides to call PersonY	awared
oReact	PersonX tosses ___ around	happy
oReact	PersonX gives PersonY a picture	interested
oReact	PersonX leads the ___ astray	lost
oReact	PersonX has dinner at PersonY's house	happy.
oReact	PersonX calls the police for help	urgency
oReact	PersonX hides in PersonX's room	shunned
oReact	PersonX texts back	happy
oReact	PersonX steals PersonY's wallet	sad
oReact	PersonX starts yelling at PersonY	hurt
oReact	PersonX wins the election	nervous if they didn't vote for personx
oReact	PersonX gives a pop quiz	surprised
oReact	PersonX has a great time at the party	happy.
oReact	PersonX takes PersonY's daughter	disturbed
oReact	PersonX cooks dinner for PersonY's girlfriend	betrayed
oReact	PersonX keeps PersonY in the dark	unknowing
oReact	PersonX sends ___ to the store	lazy to help
oReact	PersonX assists the ___ in making	easy to finish to his work
oReact	PersonX scores the winning goal	happy
oReact	PersonX wrecks PersonY's car	his friend unhappy and breakup their relationship
oReact	PersonX gives it to PersonY's mom	happy.
oReact	PersonX uses PersonY's ___ to make	very positive about person x
oReact	PersonX gives PersonY a lecture	happy to learn.
oReact	PersonX takes ___ for ice cream	appreciated
oReact	PersonX loses the match	sad
oReact	PersonX takes advantage of PersonY opportunity	sad.
oReact	PersonX looks PersonY in the eyes	noticed
oReact	PersonX throws off balance	unbalanced
oReact	PersonX sits at PersonY's desk	indifferent
oReact	PersonX spends the night with PersonY	in love as well
oReact	PersonX saves PersonY life	grateful
oReact	PersonX gives PersonY a haircut	refreshed
oReact	PersonX uses PersonY's internet	good.
oReact	PersonX offer PersonY the job	confident
oReact	PersonX pays PersonY price	making progress
oReact	PersonX protects ___ from exploitation	grateful
oReact	PersonX meets society 's ___	pride
oReact	PersonX spins a yarn	relaxed
oReact	PersonX maintains PersonX's authority	powerful
oReact	PersonX asks ___ what happened	happy
oReact	PersonX pulls PersonY's back	alert
oReact	PersonX pushes PersonY's chair	annoyed that the chair is moved
oReact	PersonX gives the speech	enlightened
oReact	PersonX quickly called ___	surprised
oReact	PersonX fights PersonX's way out	belligerant
oReact	PersonX tastes great	satisfied
oReact	PersonX takes PersonY's hours	thankful
oReact	PersonX supplies PersonY with information	happy
oReact	PersonX takes my breath away	infatuated
oReact	PersonX deprives PersonY of the power	manipulated.
oReact	PersonX ends ___ early	unhappy
oReact	PersonX studies PersonY's face	important
oReact	PersonX turns PersonY's face away	sad
oReact	PersonX asks PersonY's parents	respected
oReact	PersonX mounts PersonY horse	irritated
oReact	PersonX buys PersonX's friend	thankful
oReact	PersonX hears a knock on PersonY's door	upset
oReact	PersonX hides PersonX's light under a bushel	irritated
oReact	PersonX eats PersonY food	upset
oReact	PersonX raises an eyebrow at PersonY	watched
oReact	PersonX brings PersonY closer	satisfied
oReact	PersonX is dating a girl	connected
oReact	PersonX kills PersonY's wife	mournful
oReact	PersonX guides ___ even more forcefully onto	angry and defensive
oReact	PersonX treats ___ to ice cream	happy they get ice cream
oWant	PersonX holds PersonX's horses	to reason with PersonX
oWant	PersonX puts two together	to laugh
oWant	PersonX gives PersonX's candy	To ask how it tastes
oWant	PersonX hangs ___ on PersonX's wall	To compliment X on taste
oWant	PersonX gives ___ PersonX's money	to thank PersonX
oWant	PersonX suits PersonY's taste	show admiration
oWant	PersonX talks for hours	to talk
oWant	PersonX calls the company	answer phone
oWant	PersonX is super happy	to thank x
oWant	PersonX raises the ___ to PersonX's lips	return the favor
oWant	PersonX builds PersonY's nest	check out the nest
oWant	PersonX makes PersonY more comfortable	to be comfortable
oWant	PersonX gives PersonY pain	to fight PersonX
oWant	PersonX accepts into college	to celebrate with their family/friend
oWant	PersonX lies at PersonY's feet	move feet
oWant	PersonX wants to surprise PersonX's girlfriend	enjoy surprise
oWant	PersonX does ___ in PersonX's power to make	to stay under control
oWant	PersonX buys PersonY a new one	to give the old one to their brother.
oWant	PersonX protests too much	stay away from PersonX
oWant	PersonX puts ___ on PersonY's face	wipe face
oWant	PersonX expresses PersonX's ___ freely	to respond to what was expressed
oWant	PersonX includes this book 's ___	to give feedback to PersonX
oWant	PersonX visits PersonX's grandma	to buy dinner
oWant	PersonX strokes PersonY's cheek	talk about how they feel
oWant	PersonX starts a lemonade stand	chat to X to keep them company
oWant	PersonX asks PersonY a questions	to satisfy person x with answers
oWant	PersonX loses PersonY job	to get a new job
oWant	PersonX keeps PersonY long	to avoid being rude
oWant	PersonX plays speed chess	play again
oWant	PersonX seeks PersonY interview	to evaluate PersonX
oWant	PersonX says PersonY name	To see who is calling them
oWant	PersonX drives around PersonY's neighborhood	to welcome PersonX.
oWant	PersonX puts PersonX's ___ on the line	to reward PersonX for their bravery
oWant	PersonX takes care of PersonX's children	to talk to PersonX
oWant	PersonX improves PersonY's quality	to succeed
oWant	PersonX acknowledges with thanks the ___	to shake PersonX's hand
oWant	PersonX pulls PersonY back	to be allowed to fight
oWant	PersonX plays very well	to attend x's performances
oWant	PersonX plays basketball with PersonX's friends after school	to rest
oWant	PersonX meets PersonY for the first time	to start a project
oWant	PersonX sees a man about a horse	to let Person X tide the horse.
oWant	PersonX uses the ___ to obtain	to see it
oWant	PersonX invites PersonY's friend	thank PersonX for the invitation
oWant	PersonX uses ___ to PersonY's advantage	to observe PersonX
oWant	PersonX attends a concert	watch band
oWant	PersonX picks ___ up from work	to say thank you
oWant	PersonX sees PersonY's reaction	ask PersonX what their problem is
oWant	PersonX suits one 's ___	to be accepted
oWant	PersonX leaves PersonX's job	to persuade PersonX to stay
oWant	PersonX shares PersonX's husband 's ___	X to go away
oWant	PersonX lives near PersonY	to become friends with personx
oWant	PersonX gives unto PersonY	to settle the the argument
oWant	PersonX follows the ___ closely	to grade their work
oWant	PersonX takes no prisoners	pillages
oWant	PersonX changes PersonX's ___ for better	to observe PersonX
oWant	PersonX makes a film	to watch it
oWant	PersonX meets girls	to know if PersonX has ulterior motives
oWant	PersonX takes PersonY to the animal shelter	a new puppy
oWant	PersonX reads PersonY account	their side of the story considered
oWant	PersonX performs PersonY's function	comforted
oWant	PersonX hears PersonY's cry	to keep crying
oWant	PersonX assists ___ in identifying	to understand the findings
oWant	PersonX goes to the bar with PersonX's friends	to talk about fun things
oWant	PersonX blesses PersonY soul	salvation
oWant	PersonX abolishes the ___ altogether	to find other pursuits
oWant	PersonX keeps PersonY's mouth shut	to stay quiet
oWant	PersonX gives PersonY a shove	to shove back
oWant	PersonX bars PersonY's way	to push person aside
oWant	PersonX makes the call	to ignore the phone
oWant	PersonX complains to PersonY's mother	do something to help PersonX
oWant	PersonX enjoys PersonY's work	express their gratitude
oWant	PersonX hits ___ in the face	ask why person x hit them
oWant	PersonX returns the wallet	provide a reward
oWant	PersonX prevents a ___ from forming	to stop person x
oWant	PersonX adopts the cat	purr
oWant	PersonX puts a lid on it	to give them a look
oWant	PersonX rubs PersonY's hands	to say thank you
oWant	PersonX lays down next to PersonY	to enjoy the stars
oWant	PersonX takes ___ to the shelter	to shut the shelter door
oWant	PersonX decides to ask PersonY	to accept PersonX's offer
oWant	PersonX provides PersonY means	to have needs met
oWant	PersonX knows PersonY very well	To meet PersonX
oWant	PersonX laughs and told	laugh along
oWant	PersonX brings PersonY along	to thank personx
oWant	PersonX takes ___ to the shelter	to find a job
oWant	PersonX solves the country 's ___	to thank PersonX
oWant	PersonX leaves PersonY's apartment	clean up
oWant	PersonX takes a taxi	to accept payment
oWant	PersonX turns a deaf ear	to get angry at PersonX
oWant	PersonX is getting late	to wait for PersonX
oWant	PersonX picks ___ up from work	don't have to walk home
oWant	PersonX observes PersonY closely	help getting a drink to take the medicine with
oWant	PersonX gives money	pay a bill
oWant	PersonX kills PersonY's wife	to have a funeral for their wife
oWant	PersonX seizes ___ by force	run away
oWant	PersonX tickles PersonY's funny bone	laugh some more
oWant	PersonX asks PersonY to get	to help
oWant	PersonX gives PersonY a hint	to thank PersonX
oWant	PersonX is cleaning out PersonY's garage	to thank them
oWant	PersonX follows PersonY closely	call cops
oWant	PersonX tells mike	talk to person x about situation
oWant	PersonX loses PersonY life	PersonX to go jail
oWant	PersonX adopts the cat	meow
oWant	PersonX revolves around PersonY	to be in control
oWant	PersonX stops PersonY in his tracks	to get back to what they were doing
oWant	PersonX fees the kitten	to eat the food
oWant	PersonX feels PersonY's fingers	to pull away
oWant	PersonX purchases the ingredients	to help cook with the ingredients
oWant	PersonX makes PersonY estimate	Esitmate
oWant	PersonX drives ___ the point	to get the point
oWant	PersonX gets near PersonY	acknowledge personX
oWant	PersonX teaches PersonY to read	to listen to PersonY
oWant	PersonX uses PersonY index	people to learn things from their work
oWant	PersonX never let ___	to be left alone
oWant	PersonX loves PersonY's ___ also	to tell PersonX what they feel
oWant	PersonX gives PersonY a blow	to scream
oWant	PersonX makes sense to PersonY	ask for more details
oWant	PersonX gives PersonY a gift	to open the gift.
oWant	PersonX meets ___ after the show	go somewhere together
oWant	PersonX makes the noise	to wonder what PersonX is going to do
oWant	PersonX makes PersonY example	to thank person X
oWant	PersonX offers ___ the job	to decline the job
oWant	PersonX makes eye contact with PersonY	to meet PersonX
oWant	PersonX fixes upon PersonY	Thank them
oWant	PersonX goes to a party with PersonX's friends	to make PersonX drink
oWant	PersonX gets saved	to help someone else
oWant	PersonX provides PersonY education	to buy cap and gown
oWant	PersonX claims PersonX's prize	to confirm personX won the prize
oWant	PersonX goes wrong	to learn from it too
oWant	PersonX takes the ___ into PersonX's hands	to follow his advice
oWant	PersonX puts an ad in the paper	print ad
oWant	PersonX hears ___ yet	to see what happened
oWant	PersonX pulls away from PersonY	to control x
oWant	PersonX transmits by PersonY means	help with the equipment
oWant	PersonX takes PersonY breath away	kiss PersonX
oWant	PersonX protects ___ from injury	stay safe in the future
oWant	PersonX hurts PersonY's leg	to get medical attention
oWant	PersonX finds a puppy	growl
oWant	PersonX tells by PersonY idiot	to yell at PersonX
oWant	PersonX lets PersonY die	to thank PersonX for trying to do everything.
oWant	PersonX cuts PersonY hair	to pay PersonX
oWant	PersonX changes PersonX's views	to gain x as an ally
oWant	PersonX takes PersonY's wallet	cancel any cards
oWant	PersonX threatens PersonY's life	call the cops
oWant	PersonX gives PersonY a lift	to thank PersonX
oWant	PersonX uses PersonY's thumb	to shake PersonX off
oWant	PersonX makes PersonY inventory	to thank x for the work
oWant	PersonX turns PersonY's ___ to anything	to slap for performance
oWant	PersonX always beats ___	to become better
oWant	PersonX shuts behind PersonY	Walk away
oWant	PersonX sends PersonY to summer camp	Get bitten by mosquitoes
oWant	PersonX signs PersonY name	to scold PersonX
oWant	PersonX wipes the ___ from PersonX's face	to cry on PersonX's shoulder
oWant	PersonX does the trick	applause
oWant	PersonX uses PersonY form	get a new form
oWant	PersonX invites ___ to PersonX's party	to go to the party
oWant	PersonX calms PersonY's nerves	to relax
oWant	PersonX makes PersonY money	to deposit the money in the bank
oWant	PersonX declares ___ on the states	to watch out for person X
oWant	PersonX loves PersonY's ___ much	hang out with person x
oWant	PersonX hears back from PersonY	to terminate all contacts with person X
oWant	PersonX takes PersonY back home	to relax and watch tv
oWant	PersonX fires ___ on the spot	defend themselves
oWant	PersonX meets PersonY's expenses	to start saving to pay Person X back.
oWant	PersonX prevents PersonY from making	to gain control
oWant	PersonX gives PersonY's husband ___	get busy
oWant	PersonX steps on PersonY's toes	to forgive PersonX
oWant	PersonX gets plastic surgery	to compliment PersonX
oWant	PersonX feels horrible	to accept their apology
oWant	PersonX asks PersonY's husband	to answer the questions
oWant	PersonX comes home to roost	ask person x about his travels
oWant	PersonX tries to wake PersonY up	Ease the tension with person Y.
oWant	PersonX receives good grades	to see Person X keep getting good grades.
oWant	PersonX preserves PersonY's identity	to get back to their life
oWant	PersonX sends umi a ___	to read it
oWant	PersonX is drunk one night	To keep X safe
oWant	PersonX shows it to PersonY's parents	to see what this about
oWant	PersonX prevents and control ___	to make an appointment
oWant	PersonX makes an a on PersonY's test	to give PersonX their homework to take
oWant	PersonX lets PersonY's stay	to give money
oWant	PersonX brings ___ to a crisis	to thank Person X.
oWant	PersonX locks PersonY's keys	for PersonX to stop
oWant	PersonX changes PersonY's views	Call him everyday.
oWant	PersonX supports PersonY's claims	to support him
oWant	PersonX takes a licking and keep on ticking	to keep punching personX
oWant	PersonX fulfills PersonY's obligations	He can have more vacation time.
oWant	PersonX marries PersonY's brother 's ___	to make a toast to PersonX and their niece
oWant	PersonX makes soup	clean the kitchen
oWant	PersonX obtains PersonY's release	to receive the royalties
oWant	PersonX clips PersonY's wings	to run away
oWant	PersonX means much to PersonY	kiss person x
oWant	PersonX asks ___ to the dance	to buy a suit
oWant	PersonX pulls ___ over PersonY's head	pull their shirt down
oWant	PersonX spends time with PersonY	to get to know PersonX better
oWant	PersonX pushes PersonY around	To push back
oWant	PersonX moans into PersonY's mouth	to help him
oWant	PersonX whispers in PersonY's ear	to have alone time with PersonX
oWant	PersonX moves PersonY's things	To help out X
oWant	PersonX finds PersonY evidence	to get free.
oWant	PersonX pulls PersonY's close	to push PersonX away
oWant	PersonX turns the other cheek	to listen to PersonX
oWant	PersonX asks PersonY's friend for help	listen to more problems
oWant	PersonX holds the reins	to get to their destination
oWant	PersonX kisses arse	to talk about it.
oWant	PersonX gets PersonY understanding	to understand in return
oWant	PersonX prepares ___ for college	find a roommate
oWant	PersonX kills the ___ but can not kill	to call the authorities
oWant	PersonX asks PersonY's crush	Observe personx's reaction
oWant	PersonX tells the person	to listen to personX
oWant	PersonX is driving PersonY nuts	to get away as fast as possible
oWant	PersonX catches PersonX's death	To have a funeral in x honor
oWant	PersonX accidentally hit ___	to get revenge
oWant	PersonX helps PersonY find it	Give him ten bucks.
oWant	PersonX directs toward PersonY	argue with X
oWant	PersonX roasts marshmallows	to eat the marshmallows
oWant	PersonX tells PersonY to get a job	help mind
oWant	PersonX calls PersonY yesterday	to hang out
oWant	PersonX gets ___ anyway	to know the message
oWant	PersonX invites everyone	to thank PersonX for the invite
oWant	PersonX knows PersonY's names	to avoid him
oWant	PersonX boos PersonY off the stage	to not care (PersonY)
oWant	PersonX draws PersonY inference	to be understood
oWant	PersonX gives PersonX's position	thank PersonX
oWant	PersonX pulls a rabbit out of a hat	to be entertained
oWant	PersonX prevents PersonY attack	find the toughest gang in prison to join
oWant	PersonX performs PersonY function	to reward PersonX
oWant	PersonX loses PersonX's first tooth	to put money under their pillow
oWant	PersonX simply buy ___	PersonX to text pictures of the car
oWant	PersonX learns to skateboard	to encourage him
oWant	PersonX makes lots of friends	to make new friends too
oWant	PersonX wants PersonY answer	not talk about it
oWant	PersonX is planning PersonY's wedding	to get married
oWant	PersonX asks PersonY to write	to get paid for their work
oWant	PersonX sees PersonY's name	to welcome PersonX
oWant	PersonX places PersonX's ___ on the throne	to secure their power
oWant	PersonX is having a birthday party	to have a good time
oWant	PersonX sees PersonY in PersonZ's office	to congratulate PersonX
oWant	PersonX plays PersonY's part	to congratulet personX
oWant	PersonX collapses on the ground	to ensure x is okay
oWant	PersonX moves closer to PersonY	to ignore PersonX
oWant	PersonX walks around downtown	to tell them what they did
oWant	PersonX performs PersonY function	to ask the boss what goes on
oWant	PersonX keeps PersonX's counsel	help there client
oWant	PersonX ties ___ together	become closer to person x
oWant	PersonX sends the ___ away	to make a sale
oWant	PersonX calls PersonX's doctor	to have a conversation with PersonX
oWant	PersonX sees it in PersonY's eyes	to think about Personx's intentions
oWant	PersonX is really impressed	to work at PersonX's company
oWant	PersonX knows PersonY well enough	to be friends
oWant	PersonX jumps right	to appreciate him
oWant	PersonX summons another ___	to help him
oWant	PersonX makes PersonY return	to go on a date
oWant	PersonX swears on a stack of bibles	ask questiosn
oWant	PersonX comes to PersonY's aid	to hug person x for their help
oWant	PersonX averts PersonY's eyes	to turn back and continue watching
oWant	PersonX draws PersonY close	to scream
oWant	PersonX rubs PersonY's forehead	PersonX to stop
oWant	PersonX pulls ___ to safety	to make sure their surfboard is safe
oWant	PersonX starts work	to finish the job they are working on
oWant	PersonX drives PersonY to despair	cry
oWant	PersonX mistakes PersonY's ___ for a hat	She screamed out.
oWant	PersonX wants ___ for breakfast	to make PersonX happy
oWant	PersonX looks past PersonY	to ignore PersonX
oWant	PersonX builds PersonY's houses	to use PersonX for future projects
oWant	PersonX tries PersonX's hand at baking	to get the recipe for the dessert
oWant	PersonX pursues PersonY's way	pay PersonX
oWant	PersonX sends a quick message	to reply
oWant	PersonX sends ___ abroad	call them
oWant	PersonX hides the sausage	to find the sausage
oWant	PersonX places the ___ in a position	to support him
oWant	PersonX comes to PersonY's rescue	chat with X
oWant	PersonX becomes a father	to see the baby.
oWant	PersonX goes ___ with PersonX's father	to send PersonX back home
oWant	PersonX uses PersonY number	talk
oWant	PersonX changes men 's ___	to thank x profusely
oWant	PersonX brings PersonX's ___ together	to support PersonX
oWant	PersonX continues PersonY's search	to rest
oWant	PersonX expresses PersonY ___ to PersonZ wife	to keep the secret
oWant	PersonX makes PersonY's coffee	If a good tip for the good coffee.
oWant	PersonX walks to PersonY's house	engage in an activity
oWant	PersonX makes ___ at school	to know more about PersonX
oWant	PersonX gives PersonY a welcome	to give PersonX a hug
oWant	PersonX takes PersonY's two kids	to enjoy free time without children
oWant	PersonX takes PersonY's seat	To have seat back
oWant	PersonX asks if PersonY needed help	to thank PersonX
oWant	PersonX locks PersonY's keys in PersonX's car	to jimmy the door open
oWant	PersonX makes PersonY offering	to make use of the offering
oWant	PersonX keeps PersonY in the loop	to listen to person x
oWant	PersonX writes PersonY a ticket	to protest
oWant	PersonX visits PersonX's relatives	relax at home
oWant	PersonX eventually gave in	to get personx to do something
oWant	PersonX lifts PersonY's legs	to cry because of the pian
oWant	PersonX pays PersonY homage	to thank PersonX
oWant	PersonX misses PersonX's friends	to talk to him
oWant	PersonX calls the ___ to arms	rally around X.
oWant	PersonX plays a joke on PersonY	to be entertained
oWant	PersonX takes ___ to arrive	to greet PersonX
oWant	PersonX borrows some money	to make an investment
oWant	PersonX loses ground	to make sure he losses
oWant	PersonX pays PersonY's bill	Tell him thanks.
oWant	PersonX pulls PersonY away	To break free from X
oWant	PersonX treats PersonX's ___ well	to know PersonX's motives for such good behaviour
oWant	PersonX speeds past PersonY	to know the reason
oWant	PersonX provides another ___	thank person x
oWant	PersonX protects ___ from competition	to pay person X
oWant	PersonX executes ___ upon PersonY doeth evil	To win the battle
oWant	PersonX gathers PersonY's ___ together	to say thank you
oWant	PersonX converts ___ to energy	to praise the findings
oWant	PersonX is baking a cake	to express gratitude
oWant	PersonX enforces PersonY's rights	to show their appreciation.
oWant	PersonX ends the friendship	talk to common friends
oWant	PersonX decides to move	to show them a home
oWant	PersonX loves school	to vote for Person X in school elections.
oWant	PersonX meets PersonY's eye	to see what they been doing
oWant	PersonX wants to kill PersonY	to report to the police
oWant	PersonX eats at a diner	to provide friendly service to PersonX
oWant	PersonX calls to the bar	to hang up
oWant	PersonX gets married	to go on a honeymoon
oWant	PersonX smells delicious	to be fabulous
oWant	PersonX serves PersonY right	to learn from mistakes
oWant	PersonX settles the ___ amicably	to move on with their life
oWant	PersonX educates PersonY's children	to pay PersonX
oWant	PersonX waits upon hand and foot	to ask for more
oWant	PersonX reaches the ___ first	to order smething to eat
oWant	PersonX runs a hand through PersonY's hair	to grab PersonX's hand
oWant	PersonX takes PersonY to the animal shelter	to be thankful to person X
oWant	PersonX narrows PersonY's eyes	to recognize someone
oWant	PersonX rolls up PersonY's sleeves	to look in mirror
oWant	PersonX finds a cheap one	to sell it to PersonX
oWant	PersonX talks for an hour	to ask questions
oWant	PersonX says good night	come over
oWant	PersonX clenches PersonY's jaw	to call the cops
oWant	PersonX bids PersonY's farewell	travel to new destination
oWant	PersonX makes many new friends	to get to know PersonX
oWant	PersonX paints PersonY's fence	to express gratitude
oWant	PersonX feels like crying	to console him
oWant	PersonX is really fun	to be like PersonX
oWant	PersonX obtains every ___	to have fun with him
oWant	PersonX takes PersonY to the movies	go to dinner with his/her friend
oWant	PersonX is coming up soon	to appreciate the visit
oWant	PersonX opens PersonX's own shop	to tell others about the store
oWant	PersonX gets a full refund	to help PersonX
oWant	PersonX calls PersonY by PersonZ's name	To correct X
oWant	PersonX goes without PersonY	PersonX to feel better
oWant	PersonX sends ___ to the council	be a good representative
oWant	PersonX seeks PersonY interview	to get the job
oWant	PersonX falls asleep in class	(teacher) tell PersonX off
oWant	PersonX makes ___ on the basis	to adhere to the policies
oWant	PersonX helps PersonY study	to understand what PersonX is saying
oWant	PersonX bases upon PersonY	to be convincing
oWant	PersonX holds ___ for life	to remove PersonX
oWant	PersonX plays PersonY ___ in the development	to utilize support
oWant	PersonX executes wrath upon PersonY doeth ___	To say sorry to X
oWant	PersonX defeats every ___	be forgiven
oWant	PersonX writes a check	to say farewell
oWant	PersonX eventually ran	to save him
oWant	PersonX tells PersonY to tell	to decline orders
oWant	PersonX calls PersonX's friends over	to tell PersonX they cannot make it
oWant	PersonX hits below PersonX's weight	to congratulate PersonX on their achievement
oWant	PersonX is on the soccer team	to welcome PersonX
oWant	PersonX gives PersonY idea	to have a partner
oWant	PersonX keeps PersonX's mouth shut	to scream
oWant	PersonX plays chess with PersonY	get another game
oWant	PersonX leaves disappointed	to win
oWant	PersonX buys some new shoes	to get rest from his job.
oWant	PersonX joins the king 's ___	to hire more people
oWant	PersonX lays PersonY's hands	to wonder what PersonX will do
oWant	PersonX takes ___ in the morning	to give out and exam
oWant	PersonX does n't pay attention	to laugh at person x
oWant	PersonX opens PersonY's arms	to run from PersonX
oWant	PersonX declares war against PersonY	to calm down PersonX
