prefix	input_text	target_text
xNeed	PersonX makes PersonY attack	hit personY
xNeed	PersonX takes a train to the capital city of	go to the train
xNeed	PersonX gets a hotel room	to pay
xNeed	PersonX keeps PersonX's grades up	complete assignments on time
xNeed	PersonX decides to make PersonY's breakfast in bed	to get all the ingredients out
xNeed	PersonX misses PersonX's parents	to think about the parents
xNeed	PersonX abolishes the ___ altogether	to collaborate with others
xNeed	PersonX tells PersonY's grandma	call the grandma
xNeed	PersonX goes against the grain	be aware of options for going against the status quo
xNeed	PersonX wears makeup	to apply it
xNeed	PersonX sets PersonY up on a date	to decide the time
xNeed	PersonX learns to ride a bike	to practice riding the bike
xNeed	PersonX pushes back the ___	raise arms and place hands
xNeed	PersonX checks PersonY's car	to have been called by PersonY
xNeed	PersonX believes what PersonY saw	to consider all options
xNeed	PersonX costs PersonY dollars	see what they want
xNeed	PersonX hangs the picture	Gather a hammer.
xNeed	PersonX shows PersonX's face	to want to be revealed
xNeed	PersonX keeps PersonY on ice	to keep a keen eye on PersonY
xNeed	PersonX mows the grass	to get the lawn mower
xNeed	PersonX wants to skydive	Gets the gear ready.
xNeed	PersonX knows PersonY heart	to get to know PersonY
xNeed	PersonX induces ___ in mice	buy cages
xNeed	PersonX trains PersonX's dog	treats
xNeed	PersonX falls asleep last night	to close their eyes
xNeed	PersonX performs PersonX's ___ efficiently	to train consistently
xNeed	PersonX gives PersonY order	to have authority
xNeed	PersonX rushes toward PersonY	to run
xNeed	PersonX goes ___ one day	a plan
xNeed	PersonX gets ___ at school	sit in school bus
xNeed	PersonX finds PersonX's bike	shoes
xNeed	PersonX is another man 's ___	to spend time with another man
xNeed	PersonX puts ___ in the pan	to turn on the stove
xNeed	PersonX buys some stock	go online
xNeed	PersonX uses PersonY's ___ to secure	to have permission
xNeed	PersonX asks ___ to lunch	Contact other person
xNeed	PersonX holds PersonY's feet to the fire	to want to help persony
xNeed	PersonX submits PersonY's ___ to arbitration	to hire a lawyer
xNeed	PersonX applies the ___ to the study	to do hard
xNeed	PersonX turns the key in the lock	get out key
xNeed	PersonX shoos ___ away	to be annoyed
xNeed	PersonX plays ___ on PersonX's phone	browse app store
xNeed	PersonX loses PersonX's jobs	perform poorly at work
xNeed	PersonX buys food	to decide what to buy
xNeed	PersonX keeps PersonY healthy	buys healthy food
xNeed	PersonX takes ___ during the period	hold election
xNeed	PersonX takes PersonX's belongings	get ready to leave
xNeed	PersonX raises ___ to finance	to calculate the need
xNeed	PersonX eats ___ instead	complain to waiter
xNeed	PersonX drives PersonY to the hospital	find the car keys
xNeed	PersonX sees PersonY tomorrow	to make an appointmet
xNeed	PersonX shifts gears	understand how to shift gears
xNeed	PersonX teaches every ___	to get a job teaching
xNeed	PersonX goes to tell PersonY	to make an appointment with PersonY
xNeed	PersonX sets PersonX's ___ at ease	to become confused
xNeed	PersonX tries PersonY's luck	to steal PersonY's lucky penny
xNeed	PersonX follows ___ through society	to be shadowing them for a school article
xNeed	PersonX eats ___ every morning	to wake up early
xNeed	PersonX dries PersonX's tears	to decide to stop crying
xNeed	PersonX finds ___ in the fridge	opens the refrigerator
xNeed	PersonX takes the kids	to drive.
xNeed	PersonX changes PersonX's eating habits	to read articles online
xNeed	PersonX leaves the beach	to pack their things
xNeed	PersonX parks PersonY's car	to drive the car
xNeed	PersonX gives hostage to fortune	to know the consequences
xNeed	PersonX puts PersonY in touch	to contact PersonY
xNeed	PersonX joins the football team	to try out
xNeed	PersonX works a full time job	to drive to work
xNeed	PersonX visits PersonY's relatives	to be invited
xNeed	PersonX writes poems	to enjoy writing
xNeed	PersonX tells my parents	to find parents
xNeed	PersonX makes ___ a reality	to go on Oprah
xNeed	PersonX sneaks up behind PersonY	to be sneaky
xNeed	PersonX updates PersonX's wardrobe	buy clothes
xNeed	PersonX blinks PersonY's eyes	to reach for PersonY's eyes
xNeed	PersonX decides to major	take college courses
xNeed	PersonX hits PersonY in the head	to extend the arm
xNeed	PersonX takes ___ out to eat	compromise friend
xNeed	PersonX holds PersonX's ___ long	refuse to let go
xNeed	PersonX develops PersonX's potential	to work hard at it
xNeed	PersonX washes away the ___	be dealing with something nasty
xNeed	PersonX loses PersonX's friend	to double cross friend
xNeed	PersonX spends ___ in the hospital	to get hurt
xNeed	PersonX says bye	to decide to go home
xNeed	PersonX takes ___ to mcdonald 's	to bring them to the car
xNeed	PersonX sings and play	learning
xNeed	PersonX uses PersonY instrument	be knowing use of instrument
xNeed	PersonX goes and talked	to go see someone
xNeed	PersonX exchanges flesh	to get into a relationship
xNeed	PersonX makes millions	to work hard
xNeed	PersonX keeps telling PersonY	to be teaching PersonY
xNeed	PersonX pays PersonY's share	go to bank ATM
xNeed	PersonX suits PersonX's purpose	gets his black belt
xNeed	PersonX tries to find PersonY	look for them
xNeed	PersonX takes ___ of everything	to gather supplies
xNeed	PersonX tells PersonY PersonX's story	to live his life
xNeed	PersonX gets a table	remodel kitchen
xNeed	PersonX asks PersonY thought	to think of what to say
xNeed	PersonX asserts PersonX's right	to be questioned by the police
xNeed	PersonX smells the barn	to approach a barn
xNeed	PersonX bites PersonY's lips	get in close physical contact with PersonY
xNeed	PersonX cooks ___ at home	to peel the potatoes
xNeed	PersonX sees the elephants	walk to the exhibit
xNeed	PersonX has just graduated college	attend class
xNeed	PersonX reports the ___ to the police	to collect the details
xNeed	PersonX changes PersonX's habits	to understand themselves
xNeed	PersonX brings the kitten home	pick up the kitten
xNeed	PersonX pushes the ___ aside	to approach something
xNeed	PersonX sticks PersonY's hand	something to stick into Person Y's hand.
xNeed	PersonX asks the students	to work at a school
xNeed	PersonX gets PersonY job	to spread rumor about personY
xNeed	PersonX is browsing the internet	to open the browser
xNeed	PersonX explains the situation to PersonY	to be sure he knows the answer
xNeed	PersonX finds PersonX's hotel	go out of house
xNeed	PersonX sees PersonY in person	to look at PersonY
xNeed	PersonX loves italian food	to taste Italian food
xNeed	PersonX comes home to PersonY	to get ready
xNeed	PersonX takes PersonX's exam	to have studied all night
xNeed	PersonX shalts ___ on PersonX's head	to start a fire
xNeed	PersonX likes PersonY back	to know
xNeed	PersonX bakes a cake	to have an oven
xNeed	PersonX is on my way home	to of left
xNeed	PersonX takes ___ to the mechanic	to make an appointment with the mechanic
xNeed	PersonX lights candles	to buy candles
xNeed	PersonX turns PersonX's ___ toward PersonY	to become aware that Person Y is near.
xNeed	PersonX slings ___ over PersonY's shoulder	go near him
xNeed	PersonX turns PersonX's ___ towards PersonY	to see PersonY approaching
xNeed	PersonX goes home happy	socialize with friends
xNeed	PersonX rings up the curtain	to grab the curtain
xNeed	PersonX makes it out alive	to run fast
xNeed	PersonX stays at a hotel	to book a reservation
xNeed	PersonX raises PersonY's eyes	to laugh
xNeed	PersonX leaves PersonX's country	to get a passport
xNeed	PersonX does n't go well	to get in a car
xNeed	PersonX passes a note	to look at the person
xNeed	PersonX plays baseball with PersonX's friends	learn the rules
xNeed	PersonX sees many animals	goes to the zoo
xNeed	PersonX wraps my arms around PersonY's neck	to approach PersonY
xNeed	PersonX reaches PersonX's goal	to work hard
xNeed	PersonX buys some new shoes	to pick the shoes he wants.
xNeed	PersonX throws a tantrum	to want the attention
xNeed	PersonX has a lot of fun playing	attend a birthday party
xNeed	PersonX falls asleep in class	sit down
xNeed	PersonX develops PersonY system	to make plans
xNeed	PersonX increases PersonY's understanding	to knowing Y
xNeed	PersonX makes chicken	to prepare the ingredients
xNeed	PersonX wants to go on a vacation	to check if they have money
xNeed	PersonX needs an oil change	to drive car non stop
xNeed	PersonX makes brownies	to get the ingredients together
xNeed	PersonX regains PersonX's position	to push harder
xNeed	PersonX decides to go to the hospital	to have someone sick at the hospital
xNeed	PersonX leaves ___ in the sink	To go to the sink
xNeed	PersonX makes christmas cookies	fun
xNeed	PersonX gets an award	do good work
xNeed	PersonX becomes separated	do not get alone with spouse
xNeed	PersonX blows to kingdom come	to have a gun
xNeed	PersonX diagnoses with cancer	to understand how to identify it
xNeed	PersonX puts PersonY's ___ away	to ask if person y needs help
xNeed	PersonX is so happy to see PersonY	to like PersonY.
xNeed	PersonX plays musical chairs	to get out the chairs
xNeed	PersonX plays golf	to go to the course
xNeed	PersonX has a lot of friends	to be outgoing
xNeed	PersonX falls asleep during the test	attend the class
xNeed	PersonX goes ___ with my dad	to get together
xNeed	PersonX thinks could handle	accept work load
xNeed	PersonX cries like a PersonY	sees blood from hand
xNeed	PersonX invites PersonY over to PersonZ's house	call personY.
xNeed	PersonX makes it to the finals	to be dedicated
xNeed	PersonX goes back to the century	to make a time traveling device
xNeed	PersonX calls someone	pick up their phone
xNeed	PersonX puts PersonY in a jar	to have pickled PersonY
xNeed	PersonX shops at the store	he needs to pick out the store he want to shop at
xNeed	PersonX wears contacts	to buy contacts
xNeed	PersonX cancels PersonX's date	explain to person the reason
xNeed	PersonX smiles back	to be around people
xNeed	PersonX loves PersonY well	To meet PersonY
xNeed	PersonX enters PersonX's father 's ___	to have been called by father
xNeed	PersonX treats ___ differently	to give special favors
xNeed	PersonX keeps PersonX's house	to learn how to wash dishes
xNeed	PersonX closes the distance between PersonY	to run faster
xNeed	PersonX prohibits ___ in the territories	to have permission from the peopl
xNeed	PersonX gives ___ to PersonY's grandmother	bakes cookies
xNeed	PersonX reads the ___ carefully	learn to read.
xNeed	PersonX purchases a new car	to apply for a loan
xNeed	PersonX takes PersonY's clothes	find out where their clothes are
xNeed	PersonX throws ___ on this question	to understand the situation
xNeed	PersonX gives PersonY something	to buy something
xNeed	PersonX answers PersonY's phone	go to person y
xNeed	PersonX wants to be the best	to see the benefits of being the best
xNeed	PersonX buys beer	go to supermarket
xNeed	PersonX tilts PersonY's head	be close to PersonY
xNeed	PersonX bends the knee	to be near the king
xNeed	PersonX would make fun of PersonY	to learn about PersonY's weaknesses
xNeed	PersonX pulls out PersonY's cell phone	a relationship with person y that would allow
xNeed	PersonX walks ___ from school one day	to want to leave
xNeed	PersonX answers ___ correctly	to study well
xNeed	PersonX carries the ___ farther	To resarch the theory
xNeed	PersonX pulls ___ out of PersonY's pocket	to grab it
xNeed	PersonX gives PersonY the names	paper
xNeed	PersonX finds ___ that PersonY loved	to find out what Y loves
xNeed	PersonX runs towards PersonY	to see person Y
xNeed	PersonX returns ___ to the store	to test out an item
xNeed	PersonX goes to PersonX's office	to walk to the office
xNeed	PersonX takes PersonY to a shelter	To get in the car to drive
xNeed	PersonX performs one 's ___	to practice something
xNeed	PersonX examines PersonY carefully	squint
xNeed	PersonX plays spades	take cards
xNeed	PersonX becomes friends with PersonY	to be friendly to each other
xNeed	PersonX loses badly	to have been lazy and not trained
xNeed	PersonX does ___ every week	make daily preparations
xNeed	PersonX calls PersonY away	to find Person Y.
xNeed	PersonX is celebrating PersonY's birthday	to travel to PersonY's birthday
xNeed	PersonX has eyes bigger than PersonX's belly	to eat
xNeed	PersonX gives the royal treatment	to get a crown
xNeed	PersonX dies within days	Get sick
xNeed	PersonX is dating a girl	ask a girl for a date
xNeed	PersonX gets soaking wet	jump in pool
xNeed	PersonX has just moved to a new city	to find a job
xNeed	PersonX rehearses PersonX's lines	to receive his lines for the commercial
xNeed	PersonX corners the market	to observe where the market is moving
xNeed	PersonX watches instructional videos	to find content
xNeed	PersonX goes to the park to feed the ducks	to prepare food for ducks
xNeed	PersonX whispers ___ in PersonY's ear	to have something to say
xNeed	PersonX takes five	to get tired
xNeed	PersonX sends PersonY to the principal 's office	to become a teacher
xNeed	PersonX takes an umbrella	to put their hand on the umbrella.
xNeed	PersonX promotes ___ abroad	to fly abroad
xNeed	PersonX wants to skydive	pass the training
xNeed	PersonX paints the living room	open the paint can
xNeed	PersonX gives PersonY's girlfriend ___	to approach the girlfriend
xNeed	PersonX sets PersonY up on a date	to make friends with Person Y
xNeed	PersonX wants to surprise PersonX's girlfriend	a girlfriend
xNeed	PersonX shows PersonX's gratitude	to be in company of others
xNeed	PersonX acts like a man	to observe men
xNeed	PersonX is camping with PersonX's friends	to drive to the camping site
xNeed	PersonX sees ___ differently	think critically
xNeed	PersonX eats or drink	to have something to drink
xNeed	PersonX takes PersonY's temperature	To be a doctor
xNeed	PersonX places in PersonY's hands	to grab PersonY's hands
xNeed	PersonX takes PersonY's back	to receive something from person Y
xNeed	PersonX starts yelling at PersonY	get mad
xNeed	PersonX performs PersonY function	to know the functions
xNeed	PersonX texts PersonY's friend	acquire the phone number
xNeed	PersonX persuades ___ to take	to know what to say
xNeed	PersonX learns programming	to know different languages
xNeed	PersonX knows either	to spend time with someone
xNeed	PersonX holds PersonY's ___ for years	to wait for PersonY
xNeed	PersonX closes PersonY's doors	to open Y's doors
xNeed	PersonX fees the birds	to buy some birdseed
xNeed	PersonX goes everywhere	fill the petrol tank
xNeed	PersonX gets some water	suffer dehydration
xNeed	PersonX drives on the freeway	to start the car
xNeed	PersonX is still alive	survive
xNeed	PersonX gets a dog instead	to want a different pet
xNeed	PersonX reads PersonY's letter	to find her glasses
xNeed	PersonX meets for coffee	go to coffee shop
xNeed	PersonX is at the grocery store with PersonX's mom	meet PersonX's mom
xNeed	PersonX goes check	walk somewhere.
xNeed	PersonX protects PersonY's property	to provide a safe
xNeed	PersonX plays a ___ in the future	to get involved
xNeed	PersonX sees PersonX's cat	to have seen it jumping out of the window
xNeed	PersonX feels at home	see that he has all the needed things
xNeed	PersonX changes PersonX's behavior	decide to do something different
xNeed	PersonX accompanies by PersonY's wife	to take permission from person Y
xNeed	PersonX sleeps the night	to tired
xNeed	PersonX wishes could say	to decided if they will say it or not
xNeed	PersonX starts ___ today	to have supplies
xNeed	PersonX gets PersonY's phone number	to make a good impression
xNeed	PersonX changes PersonX's position	to find another place
xNeed	PersonX eats delicious food	go to hotel
xNeed	PersonX takes ___ for granted	to spend time with someone
xNeed	PersonX gives PersonY another	move towards PersonY
xNeed	PersonX gives PersonY illustration	contact persony
xNeed	PersonX plays alone	to not share their things
xNeed	PersonX can n't wait to go back	to really enjoy the arcade
xNeed	PersonX is in the market for a new car	to go there
xNeed	PersonX hunts the eggs	to get a basket to collect the eggs.
xNeed	PersonX works out PersonX's salvation	understand wrongdoings
xNeed	PersonX gives PersonY space	Needs to be around PersonY
xNeed	PersonX finds online	to browse
xNeed	PersonX purchases ___ online	to turn on the computer.
xNeed	PersonX enters a competition	to train every day
xNeed	PersonX raises ___ to the level	meet profit goals
xNeed	PersonX wraps PersonY's arms	get gauze
xNeed	PersonX looks and looked	to move stuff around
xNeed	PersonX greets PersonY at the door	answers the door
xNeed	PersonX takes the day off	to talk to their boss
xNeed	PersonX makes ___ of oneself	to call many times
xNeed	PersonX turns state 's ___	to provide argument
xNeed	PersonX justifies one 's ___	get misunderstood
xNeed	PersonX goes and buy	to earn money
xNeed	PersonX eats away at PersonY	to hate Person Y
xNeed	PersonX takes PersonX's wife	to persuade their wife to go
xNeed	PersonX keeps ___ away	Be on his best behavior.
xNeed	PersonX reads a new book	to buy a book
xNeed	PersonX loves PersonY's enemies	to fight with PersonY
xNeed	PersonX goes mini golfing	find a place to mini golf.
xNeed	PersonX visits PersonY at work	to travel to the workplace
xNeed	PersonX goes deep sea fishing	to get a fishing pole
xNeed	PersonX makes a plan	have a goal to make the plan
xNeed	PersonX keeps PersonY going	to stimulate personY
xNeed	PersonX wins PersonY's confidence	to figure out a way to win Y's confidence
xNeed	PersonX puts PersonY to work	to have a work plan
xNeed	PersonX bites off more than PersonX can chew	open his mouth
xNeed	PersonX takes PersonY chances	figure out how to increase odds
xReact	PersonX brings ___ into the world	love for everyone
xReact	PersonX teaches ___ to students	pleased with the progress their class is making.
xReact	PersonX sprays paint	proud
xReact	PersonX finds ___ for sale	great
xReact	PersonX is driving down the highway	terrified
xReact	PersonX practises every ___	congrats
xReact	PersonX has been practicing for weeks	proud
xReact	PersonX takes ___ for ice cream	sociable
xReact	PersonX gets the pizza	happy about their meal.
xReact	PersonX rescues the cat	sad for the cat
xReact	PersonX learns ___ by heart	nice
xReact	PersonX gets a reply	relieved
xReact	PersonX suffers from depression	hopeless
xReact	PersonX crosses over PersonY's chest	a bit rude
xReact	PersonX makes PersonY image	content
xReact	PersonX evens got ___	great
xReact	PersonX has great fun	pleased
xReact	PersonX makes PersonY entrance	helpful
xReact	PersonX tells ___ PersonY loved PersonY	smug
xReact	PersonX asks PersonY to turn it down	satisfied
xReact	PersonX enjoys it so much	interested
xReact	PersonX is doing really well	good
xReact	PersonX does not make the team	disappointed
xReact	PersonX is always good	humble
xReact	PersonX flashes lights	helpful
xReact	PersonX accidentally knocked over	fearful
xReact	PersonX creates PersonY illusion	succesful
xReact	PersonX prolongs PersonY's life	proud
xReact	PersonX takes ___ to the library	accomplished
xReact	PersonX writes PersonX's letter	grateful.
xReact	PersonX takes the bus	comfortable
xReact	PersonX suffers from depression	down
xReact	PersonX has a small dog	happy
xReact	PersonX makes a deposit	wealthy.
xReact	PersonX gets what PersonY needed	accomplished
xReact	PersonX becomes a success	hardworking
xReact	PersonX preaches to the choir	drained.
xReact	PersonX asks PersonY the reason	confounded
xReact	PersonX is set up on a blind date	interested in the other person
xReact	PersonX invites PersonY over for dinner	happy
xReact	PersonX starts to slow down	safe
xReact	PersonX takes a ski trip	excited
xReact	PersonX likes PersonX's work	proud
xReact	PersonX tries to cheer PersonY up	better
xReact	PersonX is on vacation in florida	elated
xReact	PersonX has to get a cast	broken
xReact	PersonX gives PersonY's detention	baffled
xReact	PersonX feels so relieved	content
xReact	PersonX straddles PersonY's hips	embarrassed.
xReact	PersonX texts PersonY today	relieved
xReact	PersonX leaves PersonX's phone	panicked one they realize the loss
xReact	PersonX asks PersonY to join	good
xReact	PersonX gives PersonY water	helpful
xReact	PersonX makes PersonY example	upset that he had to punish person
xReact	PersonX enjoys the movie	happy
xReact	PersonX decides to take a chance	happy
xReact	PersonX decides to go for a run	pumped up
xReact	PersonX persuades the ___ to take	important
xReact	PersonX changes ___ back	satisfied
xReact	PersonX turns bright red	embarassed
xReact	PersonX allows PersonY to keep the dog	warm and fuzzy
xReact	PersonX never liked ___	grumpy
xReact	PersonX posts ___ on instagram	proud
xReact	PersonX does everything right	right
xReact	PersonX sits in PersonY's chair	good, that he can finally sit down
xReact	PersonX spends ___ on the grade	successful
xReact	PersonX buys some shoes	excited
xReact	PersonX keeps mum	silenced
xReact	PersonX takes PersonY's friends	glad
xReact	PersonX defines the ___ in terms	satisfied
xReact	PersonX builds ___ together	inclusive
xReact	PersonX gives PersonY information	good.
xReact	PersonX strokes PersonY's hair	happy
xReact	PersonX puts on PersonX's dancing shoes	excited and eager
xReact	PersonX opens PersonY's gift	excited
xReact	PersonX always listened	caring
xReact	PersonX avenges PersonX's brother 's ___	enraged and unforgiving
xReact	PersonX takes a joke	secretly ashamed
xReact	PersonX does something special	accomplished
xReact	PersonX dances with PersonY's friends	energized
xReact	PersonX makes a move	silly
xReact	PersonX goes back and forth	satisfied with their choice.
xReact	PersonX owes money	cheap
xReact	PersonX keeps going	proud
xReact	PersonX lies on either side	refreshed
xReact	PersonX suddenly felt ___	sad
xReact	PersonX lives comfortably	content
xReact	PersonX surprises PersonY's friend	good about themelves
xReact	PersonX flies high	free
xReact	PersonX has trouble sleeping	frustrated
xReact	PersonX gets tackled	in pain
xReact	PersonX settles PersonX's affairs	accomplished
xReact	PersonX provides PersonY atmosphere	useful
xReact	PersonX wants a baby	lonely
xReact	PersonX reduces the ___ by a factor	nice
xReact	PersonX waits to get home	patient
xReact	PersonX likes to dance	nan
xReact	PersonX shoots the boots	bored
xReact	PersonX sees things differently	invigorated
xReact	PersonX treats PersonY with respect	respectful
xReact	PersonX begins PersonY program	more aware.
xReact	PersonX leaves PersonX's mom	like they are going somewhere on their own
xReact	PersonX gets married a year later	anxious
xReact	PersonX thanks everyone	grateful
xReact	PersonX enters the building	curious
xReact	PersonX swims at the beach	wet
xReact	PersonX comes home late	tired
xReact	PersonX travels a lot	stressed
xReact	PersonX gets a black eye	hurt
xReact	PersonX runs for cover	safe
xReact	PersonX takes ___ out of the refrigerator	like the food was stored well
xReact	PersonX gets PersonX's passport	adventurous
xReact	PersonX pays PersonY's back	responsible
xReact	PersonX walks well	accomplished
xReact	PersonX fights for PersonY's country	exhasuted
xReact	PersonX is actually really good	happy that someone appreciates their skill
xReact	PersonX sees the elephants	frightened if they are attacking
xReact	PersonX slowly worked ___ deep	satisfied
xReact	PersonX gives the person	happy to help out
xReact	PersonX takes ___ to the circus	like they will enjoy the silly show
xReact	PersonX puts an ad in the paper	happy
xReact	PersonX immediately picked it up	curious
xReact	PersonX meets PersonX's mom	misunderstood
xReact	PersonX coughs a lot	sick
xReact	PersonX takes every precaution	shletered
xReact	PersonX loses all of PersonY's money	sad
xReact	PersonX accidentally got ___	hurt
xReact	PersonX uses sunscreen	confident
xReact	PersonX spills red wine	embarrassed
xReact	PersonX gets lucky	surprised
xReact	PersonX faces squarely the ___	brave and strong
xReact	PersonX finds ___ on the beach	good
xReact	PersonX born this ___ in the city	alive
xReact	PersonX starts ___ last week	invigorated
xReact	PersonX sits at PersonY's desk	apprehensive
xReact	PersonX lies beyond the scope	aloof
xReact	PersonX is a very picky eater	critical
xReact	PersonX falls asleep last night	proud for having helped.
xReact	PersonX offers PersonY a position	good
xReact	PersonX buys a gun	safe
xReact	PersonX watches PersonY's favorite show	friendly
xReact	PersonX likes to drink	relaxed
xReact	PersonX pursues PersonX's studies	accomplished
xReact	PersonX gets some help	healthy
xReact	PersonX adopts the kitten	happy
xReact	PersonX says it was okay	nonchalant
xReact	PersonX practices yoga	relaxed
xReact	PersonX starts PersonY business	resolved
xReact	PersonX eats ___ in the kingdom	satisfied
xReact	PersonX buys ___ a new one	good
xReact	PersonX says hello	freindly
xReact	PersonX takes ___ to a pawn shop	relieved
xReact	PersonX plays the guitar	determined
xReact	PersonX has a green thumb	capable
xReact	PersonX laughs PersonX's head off	like something was hilarious
xReact	PersonX gets PersonX's car repaired	responsible
xReact	PersonX wants to work	accomplished
xReact	PersonX continues PersonX's course	accomplished by themselves
xReact	PersonX loves candy	satisfied
xReact	PersonX does n't feel like cooking	lazy
xReact	PersonX pushes PersonY's head	domineering and controlling.
xReact	PersonX uses PersonX's ___ to get	no longer hungry
xReact	PersonX has no money left	awful and depressed
xReact	PersonX kicks PersonY's legs	mean
xReact	PersonX braids PersonY's hair	important
xReact	PersonX has to go to the doctor	worried
xReact	PersonX receives PersonY's orders	controlled
xReact	PersonX buys a new pair	satisfied
xReact	PersonX works with children	dependable
xReact	PersonX fish in troubled waters	shameful
xReact	PersonX remodels PersonY's bathroom	accomplished
xReact	PersonX is a bit nervous	nervous
xReact	PersonX feels hungry	exhausted
xReact	PersonX takes PersonY's hand	caring
xReact	PersonX gives PersonY a hard time	riled up
