prefix	input_text	target_text
other	PersonX packs a bag	go on vacation
other	PersonX throws caution to the wind	ends up safe
other	PersonX finds ___ in PersonY's closet	asks about it
other	PersonX focuses PersonY's attention	take medication
other	PersonX sees the elephants	frightened if they are attacking
other	PersonX persuades PersonY to join	join the team
other	PersonX hits PersonY's city	calls persony
other	PersonX mows PersonY's lawn	recompenses PersonX
other	PersonX buys PersonX's first house	proud
other	PersonX keeps PersonY healthy	to help PersonY live longer
other	PersonX drives to the nearest store	store owner makes money
other	PersonX persuades PersonY to leave	hurt
other	PersonX moves to colorado	travelled
other	PersonX folds ___ across PersonY's chest	PersonY's towel
other	PersonX studies for PersonX's test	passing the test
other	PersonX serves as PersonY instrument	to pay person x
other	PersonX fixes PersonX's roof	joy
other	PersonX suits PersonY's needs	needs get met
other	PersonX keeps PersonY alive	to approach PersonY
other	PersonX gets PersonX's first car	worried
other	PersonX hunts the eggs	open the eggs
other	PersonX gets tangled	to help them
other	PersonX provides PersonY method	to ask if PersonY has any questions
other	PersonX pulls PersonY's fingers out	becomes lame
other	PersonX catches a bird	come up with a plan
other	PersonX cleans PersonY's garage	they are more organized
other	PersonX stops trying	guilty
other	PersonX herds cats	makes money
other	PersonX has a new pet	excited.
other	PersonX makes PersonY award	happy
other	PersonX wipes the ___ from PersonX's brow	fufilled
other	PersonX has PersonX's hand out	gets money handed to them
other	PersonX pays ___ forward	gratitude
other	PersonX sips PersonY's tea	worry's about x getting ys cold
other	PersonX talks about PersonX's feelings	Comforted
other	PersonX stops at a light	puts foot on brake
other	PersonX spins around	dizzy
other	PersonX gets a real job	proud
other	PersonX gets a new job	to apply for a job
other	PersonX helps ___ a lot	helpful
other	PersonX loves ___ anyway	connected to him
other	PersonX raises ___ by taxation	People turn in money to pay taxation.
other	PersonX brings everyone	get to participate in the festivities
other	PersonX buys it immediately	to take it home
other	PersonX leaves immediately	move city
other	PersonX asks PersonY meant	to get news
other	PersonX hears PersonY's laugh	to happy cry
other	PersonX applies for a new job	proud
other	PersonX finds a box	interested
other	PersonX follows PersonY's home	accomplished
other	PersonX is playing football	amused
other	PersonX enters the ___ together	says hello
other	PersonX orders something	excited
other	PersonX fights for PersonY's life	to save Y
other	PersonX conducts PersonX's business	responsible
other	PersonX is going to get married	to make arrangements
other	PersonX goes down in flames	X is shamed in public
other	PersonX gives gifts	thank Person X
other	PersonX gives PersonX's lives	lucky
other	PersonX comes near PersonY	talked to each other
other	PersonX walks PersonY back	meets their destination
other	PersonX needs someone to talk to	To find the person to speak to
other	PersonX falls many times	sad
other	PersonX gives the class	to be skilled
other	PersonX loves PersonY's performance	to applaud PersonY
other	PersonX takes PersonY to church	to attend church
other	PersonX opens PersonY door	to keep the door closed
other	PersonX potty train	Person X's parents stop changing diapers
other	PersonX knocks PersonY to the ground	scared
other	PersonX finds what PersonY was looking for	picks thing up
other	PersonX uses PersonY program	successful
other	PersonX leaves ___ in too long	Rushes somewhere
other	PersonX has PersonY by the short hairs	sweat
other	PersonX spends the next week	to take time off of work
other	PersonX becomes PersonY actor	delivers their lines
other	PersonX takes a lot of work	to support PersonX
other	PersonX hangs a ralph	loses their life
other	PersonX quickly grabbed	No diffrent
xIntent	PersonX spends the night	to stay over with someone
xIntent	PersonX asks PersonY to dance	to court
xIntent	PersonX means PersonY harm	to be mean
xIntent	PersonX learns how to throw a curveball	to be the best pitcher
xIntent	PersonX opens PersonX's mouths	to yawn
xIntent	PersonX changes PersonX's tire	to safely drive their car
xIntent	PersonX gives PersonY money	to be helpful
xIntent	PersonX meets PersonY mother	to know new mother in law
xIntent	PersonX watches the news ___	to be informed
xIntent	PersonX corrects PersonY error	to help person
xIntent	PersonX wipes away PersonX's tears	to not show emotion
xIntent	PersonX provides ___ to persons	kind
xIntent	PersonX takes ___ to mexico	to give his wife a good vacation
xIntent	PersonX moves around	to see different things
xIntent	PersonX is at the county fair	to have fun
xIntent	PersonX urges PersonY to take	so excited
xIntent	PersonX sees PersonY in person	discuse matters
xIntent	PersonX fills in the blank	to solve the puzzle
xIntent	PersonX tells PersonY's everything	to be friendly
xIntent	PersonX flies around ___	to be mobile
xIntent	PersonX finally decided	resolution
xIntent	PersonX places PersonY at the head	to fight with y
xIntent	PersonX fires on all cylinders	to cause problems
xIntent	PersonX pays ___ to detail	to do things right
xIntent	PersonX makes bricks without straw	to show that it can be done
xIntent	PersonX borrows ___ to pay	to make a purchase
xIntent	PersonX kills every ___	to kill someone
xIntent	PersonX gives ___ at work	to reprimand someone
xIntent	PersonX potty train ___	to avoid a mess
xIntent	PersonX gives it back to PersonY	share it
xIntent	PersonX catches PersonY by the arm	to get their attention
xIntent	PersonX gilds the pill	look on the bright side.
xIntent	PersonX asks questions	to be clarified
xIntent	PersonX runs a marathon	to be healthy.
xIntent	PersonX checks PersonX's bank account	to see if he has enough money for a new refrigerator
xIntent	PersonX finds the movie	to watch a show
xIntent	PersonX plays ___ with my friend	to have something to do
xIntent	PersonX goes ___ to PersonY's wife	to see persony's wife
xIntent	PersonX irons PersonY's clothes	to be useful
xIntent	PersonX covers PersonY's face	to hide something from person
xIntent	PersonX cancels the trip	to not go on the trip anymore
xIntent	PersonX waits in the waiting room	to be seen as soon as possible
xIntent	PersonX turns ___ back to PersonY	to show anger to person.
xIntent	PersonX meets PersonX's needs	to take care of themselves
xIntent	PersonX cleans PersonX's car	to be in a clean environment
xIntent	PersonX gives it to PersonX's son	to be charitable
xIntent	PersonX uses ___ efficiently	to be resourceful
xIntent	PersonX kills PersonX's darlings	resentful
xIntent	PersonX pays PersonY respects	to be respectful
xIntent	PersonX begins to work	to get things done
xIntent	PersonX puts ___ aside	to move things
xIntent	PersonX plays everyday	to have fun
xIntent	PersonX makes fun of PersonY	to be obnoxious
xIntent	PersonX carries into effect PersonX's ___	something for themselves
xIntent	PersonX keeps back the ___	fear about something
xIntent	PersonX tries to help PersonY	to be moral
xIntent	PersonX performs well	to do a good job
xIntent	PersonX calls the cops	to complain
xIntent	PersonX means business	to get things done
xIntent	PersonX asks the woman	know the route to hospital
xIntent	PersonX takes to PersonX's bed	to go to sleep
xIntent	PersonX helps PersonY find it	to be helpful
xIntent	PersonX grasps at straws	to try to makes sense of a thing
xIntent	PersonX raises PersonX's grades	to graduate
xIntent	PersonX steals PersonY's car	a car
xIntent	PersonX takes PersonY's cat to the vet	to get it medical treatment
xIntent	PersonX takes PersonY's temperature	to test fever
xIntent	PersonX gets PersonX's bike	to take a ride on the bike
xIntent	PersonX goes and got ___	to be in contact with the world
xIntent	PersonX tries to pick it up	it to be off the floor
xIntent	PersonX refers the ___ to the court	to end the issue legally
xIntent	PersonX is a good fit	to fit in
xIntent	PersonX strains every ___	to be a hard-worker
xIntent	PersonX talks to PersonX's teacher	find out about an assignment
xIntent	PersonX reads PersonY's book	to learn more things by reading.
xIntent	PersonX loves going to the zoo	to be happy
xIntent	PersonX gathers PersonY's things	prepare to leave.
xIntent	PersonX turns toward PersonY	to talk to a person
xIntent	PersonX gets the ball	to play well
xIntent	PersonX gets PersonY's lunch	to be nice
xIntent	PersonX follows ___ around	to hang out with them
xIntent	PersonX eats delicious food	to enjoy his meal
xIntent	PersonX steps on the scale	to lose weight
xIntent	PersonX visits ___ one day	to have a good time
xIntent	PersonX reads ___ in one	learn
xIntent	PersonX makes PersonY's costume	to go trick or treating
xIntent	PersonX protects ___ from exploitation	grateful,
xIntent	PersonX watches PersonX's shows	to be entertained
xIntent	PersonX fixes PersonY's tire	to be helpful
xIntent	PersonX takes time	to relax
xIntent	PersonX wants to go to PersonY	to ask or tell something
xIntent	PersonX sells PersonY's home	to be a good real estate agent
xIntent	PersonX parks the bus	to keep vehicle
xIntent	PersonX makes PersonY promises	to show appreciation
xIntent	PersonX stays home ___	to relax a bit.
xIntent	PersonX finally finds	to search
xIntent	PersonX remains to be seen	to be visualized
xIntent	PersonX shakes PersonY's hands	to make a good impression
xIntent	PersonX spends some ___ looking	some time looking in person
xIntent	PersonX is driving PersonY's car on the highway	to help person y
xIntent	PersonX tastes the sauce	to test the flavor
xIntent	PersonX gives PersonY a shove	to hurt him.
xIntent	PersonX sends PersonY money	to help
xIntent	PersonX keeps PersonY company	to be supportive
xIntent	PersonX lifts PersonY's ___ in air	to have fun
xIntent	PersonX has a big crush on PersonY	to befriend them
xIntent	PersonX tells PersonY's coworkers	to tell them that persony is going to be absent.
xIntent	PersonX takes PersonY's girlfriend out to dinner	to be unfriendly
xIntent	PersonX rubs the fear of god into ___	to correct , make fearful
xIntent	PersonX enjoys the ride	to be amused
xIntent	PersonX finally saved up enough	to buy something expensive
xIntent	PersonX gets very drunk	to have fun
xIntent	PersonX writes PersonY's letter	to be helpful
xIntent	PersonX packs everything up	to go on a trip
xIntent	PersonX pulls ___ back	hair out of their face
xIntent	PersonX answers PersonY's phone	to know who is calling
xIntent	PersonX buys some groceries	have food
xIntent	PersonX holds PersonY tightly	to be close to the person
xIntent	PersonX goes for the throat	to hurt someone
xIntent	PersonX climbs the ladder	to be up high
xIntent	PersonX finds PersonY's voice	to be choosy
xIntent	PersonX improves ___ in patients	to be kind
xIntent	PersonX gives ___ medicine	to help heal someone
xIntent	PersonX leaves the ___ soon	to start a new life
xIntent	PersonX cuts the grass	to have a tidy yard
xIntent	PersonX spends ___ raking leaves	to tidy up the yard
xIntent	PersonX buys ___ as a pet	to have a companion
xIntent	PersonX makes ___ in the morning	to eat
xIntent	PersonX reads PersonY's books	to read a book.
xIntent	PersonX files PersonY's taxes	to help persony
xIntent	PersonX catches the ball	to be admired
xIntent	PersonX serves PersonY's ends	to be helpful with a good cause
xIntent	PersonX solves ___ by means	to get rid of issues
xIntent	PersonX drinks one	to have one drink
xIntent	PersonX says would bring	to buy something
xIntent	PersonX asks the girl out	to have a date for prom
xIntent	PersonX gets the food	to eat
xIntent	PersonX lets PersonY go	to fire person
xIntent	PersonX talks to PersonY's husband	be friendly
xIntent	PersonX accepts the fact	to be agreeable
xIntent	PersonX eats a lot of food	to help feel better about being alone
xIntent	PersonX opens one eye	to be sneaky
xIntent	PersonX does an excellent job	to get a good grade
xIntent	PersonX takes advantage of the opportunity	to succeed
xIntent	PersonX practices ___ in the state	to work in his profession
xIntent	PersonX makes an excuse	to be forgiven
xIntent	PersonX wins by a landslide	to become a senator.
xIntent	PersonX looks at PersonX's wife	to look
xIntent	PersonX throws ___ on this subject	good friendship
xIntent	PersonX also grabbed	to take something somewhere
xIntent	PersonX fills PersonY's glass	to help person y
xIntent	PersonX dies PersonY's hair	to help person y to look good
xIntent	PersonX returns ___ from work	to relax
xIntent	PersonX gets a tutor	to get guidance
xIntent	PersonX needs to see PersonY	to talk to person about something important
xIntent	PersonX has to go to the bathroom	to relieve themselve
xIntent	PersonX searches every ___	to find their cat.
xIntent	PersonX just started a new job	security
xIntent	PersonX starts a fire	warm
xIntent	PersonX works for days	to excel
xIntent	PersonX takes karate lessons	to learn karate
xIntent	PersonX treats PersonY badly	to punish person
xIntent	PersonX finds a replacement	someone to do better
xIntent	PersonX tries men 's souls	to get things they aren't supposed to have
xIntent	PersonX rounds the corner	to change direction
xIntent	PersonX learns karate	to be more confident
xIntent	PersonX gets an a on PersonX's test	do well in school
xIntent	PersonX smokes a cigarette	nicotine
xIntent	PersonX makes it to the top	at the top
xIntent	PersonX provides ___ for students	to be helpful
xIntent	PersonX needs a ride	to get to work on time
xIntent	PersonX gives ___ trouble	to start a fight
xIntent	PersonX runs PersonY ragged	attention from someone
xIntent	PersonX loves the beach	to relax.
xIntent	PersonX times to go home	to rest
xIntent	PersonX points PersonY's finger	to alert something
xIntent	PersonX turns away from PersonY	to away
xIntent	PersonX goes home that night	to relax in his bed
xIntent	PersonX lines dance	to participate
xIntent	PersonX pushes PersonY around	to have power over another person
xIntent	PersonX makes PersonX's bed and lie in it	to relax.
xIntent	PersonX enters PersonY's room	to find something
xIntent	PersonX knows the answers	to show how smart they are.
xIntent	PersonX fills PersonX's ___ with air	to experience the out doors
xIntent	PersonX reads more books	to be knowledgable
xIntent	PersonX begs ___ for one	to get their way
xIntent	PersonX checks on PersonX's son	to make sure the son is ok
xIntent	PersonX passes a house	to go somewhere
xIntent	PersonX makes smoothies	to go on a diet
xIntent	PersonX pays more attention	to make sure they understand
xIntent	PersonX kisses PersonY passionately	to show passion
xIntent	PersonX is going to a dance	to dance
xIntent	PersonX takes delight in ___	to enjoy himself
xIntent	PersonX gets ___ from the fridge	a snack
xIntent	PersonX starts a fight	to settle a disagreement
xIntent	PersonX enters PersonY's house	neighborly
xIntent	PersonX protects the ___ from attack	to prevent damage
xIntent	PersonX invites friends over	to be sociable
xIntent	PersonX buys a new camera	to take a lot of pictures.
xIntent	PersonX eats meat	protein
xIntent	PersonX spends ___ raking leaves	to get her chores done so she can leave
xIntent	PersonX gives the ___ time	to grow
xIntent	PersonX gives ___ up for adoption	to start new chapter
xIntent	PersonX starts smoking	to satisfy their addiction
xIntent	PersonX plays it every day	to practice guitar well
xIntent	PersonX pulls PersonY towards PersonY	to have them close
xIntent	PersonX preaches ___ to the poor	to serve the poor.
xIntent	PersonX lets PersonX's friends	his friends to know that they have permission
xIntent	PersonX goes everywhere	to see new places.
xIntent	PersonX hits ___ out of the park	to hit a home run
xIntent	PersonX makes noises	to get attention
xIntent	PersonX presses home PersonY's ___	to please person y
xIntent	PersonX asks PersonY to the dance	to have a date
xIntent	PersonX attends a concert	to enjoy music
xIntent	PersonX declines PersonY's invitation	to do something more important.
xIntent	PersonX just graduated high school	to be educated
xIntent	PersonX eases PersonY's pain	his wife to be comfortable
xIntent	PersonX gives PersonY answer	to give an answer
xIntent	PersonX takes the game to ___	a completion
xIntent	PersonX comes back to PersonY	person to talk to them.
xIntent	PersonX graduates from high school	to learn
xIntent	PersonX invites PersonX's friend PersonY	to go out and party
xIntent	PersonX appears out of nowhere	to be somewhere
xIntent	PersonX treats PersonY well	to be friendly
xIntent	PersonX cooks at home	feel comfortable
xIntent	PersonX smiles back at PersonY	be nice and fiendly
xIntent	PersonX works ___ by side	to be alongside someone while working.
xIntent	PersonX gets stronger	to feel in control
xIntent	PersonX takes dance	to practice their skills
xIntent	PersonX gets the newspaper	to read it
xIntent	PersonX provides PersonY supply	to be considerate.
xIntent	PersonX looks forward to seeing	to meet his friend from abroad
xIntent	PersonX jumps rope	to wake up
xIntent	PersonX comes back to the house	to go home
xIntent	PersonX runs PersonY's hand through PersonY's hair	to show affection
xIntent	PersonX throws a fit	to be understood
xIntent	PersonX gathers PersonY's ___ together	to cleanup the room
xIntent	PersonX visits PersonY's father 's ___	to fulfill his/her friends wish of meeting his/her father.
xIntent	PersonX buys some milk	to help out
xIntent	PersonX does whatever PersonY wanted	something person has
xIntent	PersonX tries to calm PersonY down	to be comforting
xIntent	PersonX buys new pants	to be fashionable
xIntent	PersonX distinguishes ___ from reality	to know new things
xIntent	PersonX considers the ___ separately	to learn something
xIntent	PersonX reports ___ to the police	justice
xIntent	PersonX wears every ___	to be important to wear
xIntent	PersonX takes a rest	to relax his muscles
xIntent	PersonX eats tofu	to eat
xIntent	PersonX stirs men 's ___	men 's minds was good
xIntent	PersonX sets the alarm	they want to get up on time in the morning.
xIntent	PersonX walks beside PersonY	to get somewhere
xIntent	PersonX stays calm	to avoid making a stressful situation worse.
xIntent	PersonX plays catch with PersonY's dad	to get some exercise
xIntent	PersonX buys ___ at the grocery store	to fill their pantry
xIntent	PersonX gives PersonX's dog ___	to make her dog happy by giving him a bone.
xIntent	PersonX throws ___ outside	to declutter the inside
xIntent	PersonX tells PersonY to be quiet	to concentrate on something he/she is listening to
xIntent	PersonX sells PersonY's wares	to help
xIntent	PersonX takes ___ one day	to try something
xIntent	PersonX makes eye contact with PersonY	to pay attention to the other person.
xIntent	PersonX makes a good living	be wealthy
xIntent	PersonX expresses PersonX's ___ in ways	to be different
xIntent	PersonX considers first the ___	to win the problem definitely
xIntent	PersonX is baking cookies	to try something new
xIntent	PersonX watches ___ from the bench	to coach
xIntent	PersonX sets PersonY right	to be assertive
xIntent	PersonX plays kickball	to be physically active
xIntent	PersonX adds together the ___	to analyze
xIntent	PersonX becomes tired	to get fit
xIntent	PersonX gives PersonY a treat	to cheer up person y
xIntent	PersonX buys another car	to be a good
xIntent	PersonX obeys the king 's ___	to obey
xIntent	PersonX leaves the restaurant	doesnt like the menu
xIntent	PersonX talks to PersonY's husband	start an affair
xIntent	PersonX flushes the toilet	to be considerate
xIntent	PersonX wants to be friends	companionship
xIntent	PersonX steals money	money
xIntent	PersonX depends upon the conditions	to use the conditions
xIntent	PersonX gets new shoes	to be fashionable.
xIntent	PersonX solves another ___	to practice
xIntent	PersonX becomes a lifeguard	to have a job
xIntent	PersonX asks PersonY to be PersonX's wife	married
xIntent	PersonX carves pumpkins	to decorate for halloween
xIntent	PersonX drives along	to drive to a friends'.
xIntent	PersonX sings a song	to get a tune out of their head
xIntent	PersonX reduces the ___ much	work
xIntent	PersonX tells PersonY 's going on	to reveal the truth
xIntent	PersonX sells PersonX's motorcycle	to get some money
xIntent	PersonX makes fun of PersonY's	to be jovial
xIntent	PersonX gets PersonX's own apartment	to be independent
xIntent	PersonX returns the phone	to be nice
xIntent	PersonX makes dinner	to be fed
xIntent	PersonX loses a lot of weight	to be skinny
xIntent	PersonX spends ___ searching	to make informed decisions
xIntent	PersonX kneels beside PersonY	to pray
xIntent	PersonX finds food	to satisfy his hunger
xIntent	PersonX puts the kibosh on ___	to be sure
xIntent	PersonX takes ___ to a mechanic	to get something fixed
xIntent	PersonX buys a new sofa	a more comortable place to sit
xIntent	PersonX sends PersonY a message	to tell person something
xIntent	PersonX goes swimming with friends	to get some exercise
xIntent	PersonX decides to clean it	to get rid of filth
xIntent	PersonX pulls away from PersonY	to escape.
xIntent	PersonX is no longer hungry	to satisfy their hunger
xIntent	PersonX says things to PersonY	to communicate
xIntent	PersonX takes PersonY seat	to annoy persony
xIntent	PersonX texts PersonY back	to chat
xIntent	PersonX watches a tv show	to relax
xIntent	PersonX gives PersonY evidence	to solve the case
xIntent	PersonX sits at home	to be relaxed
xIntent	PersonX reads comics	to be entertained
xIntent	PersonX saves PersonY's soul	y to live on
xIntent	PersonX joins forces	to win
xIntent	PersonX teaches ___ for years	to be clear
xIntent	PersonX lives by the ocean	to be relaxed
xIntent	PersonX takes ___ to the market	to go to the market with someone
xIntent	PersonX reconciles the ___ unto himself	peace
xIntent	PersonX shaves all of PersonX's hair off	to change their look
xIntent	PersonX stands in PersonY's shoes	know what persony is thinking
xIntent	PersonX works on PersonY's car	to make money
xIntent	PersonX avenges PersonX's brother 's ___	to pass judgment.
xIntent	PersonX defeats every ___	to be in power
xIntent	PersonX takes ___ of everything	to take responsiblity
xIntent	PersonX obtains PersonY information	to be informed
xIntent	PersonX breaks one ___	to be a rebel
xIntent	PersonX tells PersonY's mom	to be mean
xIntent	PersonX takes ___ lying down	to be peaceful.
xIntent	PersonX goes somewhere else	got a new job and moved
xIntent	PersonX tests PersonX's skills	to see if he is getting better.
xIntent	PersonX focuses on PersonX's job	to be proud of their work
xIntent	PersonX enjoys every minute	by playing football
xIntent	PersonX makes lasagna	to be creative
xIntent	PersonX quits school	to move on
xIntent	PersonX fights every ___	to never give up
xIntent	PersonX brings PersonY food	to be helpful
xIntent	PersonX takes ___ to PersonY's mom	to help his mother
xIntent	PersonX keeps going	to persevere
xIntent	PersonX casts ___ into the water	to catch a fish
xIntent	PersonX carries out PersonX's plan	to follow through
xIntent	PersonX wears ___ to the park	to look great outdoors
xIntent	PersonX is a race car driver	to enjoy cars
xIntent	PersonX decides to go fishing	to enjoy the day
xIntent	PersonX changes PersonX's habits	to be spontaneous
xIntent	PersonX defines ___ in a way	religion
xIntent	PersonX changes my life	to be kind
xIntent	PersonX is on a first date	to be romantic
xIntent	PersonX embraces in the grasp of a muscular man	to feel the man
xIntent	PersonX gets a tetanus shot	to stay healthy
xIntent	PersonX straightens PersonY's hair	to help person look his/her best.
xIntent	PersonX shakes PersonY awake	person awake
xIntent	PersonX places ___ on PersonY's shoulder	the person to knw that x cares abt them
xIntent	PersonX takes ___ to france	to indulge someone
xIntent	PersonX gives PersonY's mom	her to have it
xIntent	PersonX shows PersonY's respect	to show person y respect.
xIntent	PersonX stops going	to sleep in
xIntent	PersonX takes time	to do a thoroush job
xIntent	PersonX asserts PersonX's independence	empowered
xIntent	PersonX fees PersonY's fish	to help
xIntent	PersonX has a lot of friends	to have fun with different people.
xIntent	PersonX makes pancakes	to eat
xIntent	PersonX applies to many jobs	to make money
xIntent	PersonX treats PersonY kindly	to be friendly
xIntent	PersonX keeps warm	to feel good
xIntent	PersonX locks ___ out of the house	because they were angry
xIntent	PersonX begs for money	to be able to buy food
xIntent	PersonX goes ___ to PersonY's mother	to be supportive
xIntent	PersonX brings PersonY back to PersonZ	to help out person z
xIntent	PersonX takes PersonY share	to get more.
xIntent	PersonX leads PersonY to the door	persony to know which way to go out.
xIntent	PersonX finishes on time	to go home before dark
xIntent	PersonX keeps PersonY's head	to help
xIntent	PersonX decides to save PersonX's money	to be resourceful
xIntent	PersonX gets a new haircut	to make it easy to groom his hair
xIntent	PersonX drops trow	attention
xIntent	PersonX draws ___ from the data	to analyze
xIntent	PersonX runs away from home	to get away from home
xIntent	PersonX puts ___ in PersonY's mouth	person to eat his dinner
xIntent	PersonX speaks PersonY's mind	express their opinions
xIntent	PersonX has enough money to pay PersonX's rent	to pay the bill on time
xIntent	PersonX eats more healthy food	to be free of illness
xIntent	PersonX goes to the animal shelter	to find a pet
xIntent	PersonX demands all the money	to hand it over to the cop
xIntent	PersonX wreaks havoc	everything to go his way
xIntent	PersonX wears PersonY's hair	to put on a wig
xIntent	PersonX watches the olympics	to enjoy the watching the games
xIntent	PersonX tries to scare PersonY	to play a prank on persony.
xIntent	PersonX frames PersonY's face	have a memorable picture of them
xIntent	PersonX whispers PersonY's name	to not be heard by others.
xIntent	PersonX rides rides	to have fun
xIntent	PersonX feels a little bad	to express sadness
