prefix	input_text	target_text
xEffect	PersonX follows PersonY's father 's ___	PersonX learns of the subject
xEffect	PersonX hurts another ___	gets arrested
xEffect	PersonX divides the ___ into regions	draws a map
xEffect	PersonX takes PersonX's family to the beach	Person X enjoys time with the family.
xEffect	PersonX becomes hungry	stomach aches
xEffect	PersonX stubs PersonX's toe	gets laughed at
xEffect	PersonX cries like a baby	heart broken
xEffect	PersonX adopts a dog	to kick the punch
xEffect	PersonX buys ___ with PersonX's own money	is given the title to the car
xEffect	PersonX shows clearly the ___	receives accolades
xEffect	PersonX invites everyone	has a lot to do
xEffect	PersonX rides PersonY's skateboard	gets in accident
xEffect	PersonX taps PersonY on the shoulder	is slapped
xEffect	PersonX gets very drunk	throws up
xEffect	PersonX puts all PersonX's ___ in basket	Gets a big windfall
xEffect	PersonX walks home from school ___	drops bookbag
xEffect	PersonX sacrifices PersonX's life	is  considered a hero
xEffect	PersonX rushes to PersonY's side	Loses breath
xEffect	PersonX can barely walk	winces in pain
xEffect	PersonX waits to see PersonY	becomes impatient
xEffect	PersonX mixes the ingredients together	They cook the ingredients
xEffect	PersonX tells PersonY to follow	Runs ahead to the start of the waiting line
xEffect	PersonX publishes PersonX's work	Gets famous
xEffect	PersonX sits at home	feels rested
xEffect	PersonX eats and ___ to drink	gets full
xEffect	PersonX measures the ___ accurately	gets more adept at the preparation
xEffect	PersonX looks over PersonY's shoulder	gets pushed away
xEffect	PersonX spends many hours	gets left behind
xEffect	PersonX fixes the hole	has a warm room
xEffect	PersonX never played ___	is regretful
xEffect	PersonX protects PersonY's children	PersonX is thanked
xEffect	PersonX keeps coming back	gets back
xEffect	PersonX knows what PersonY wanted	went to the store
xEffect	PersonX rides PersonX's bike ___	PersonX gets exercise
xEffect	PersonX begins high school	studies
xEffect	PersonX has an important meeting	gets tension
xEffect	PersonX cures PersonY's boredom	seeks a proper way
xEffect	PersonX holds the bike	gets hit
xEffect	PersonX eats popcorn	at the movies
xEffect	PersonX gets it checked out	eats groceries
xEffect	PersonX sees what PersonY could do	watches
xEffect	PersonX scours the internet	They find information
xEffect	PersonX stops at the red light	more punctual
xEffect	PersonX brings ___ to the party	Causes the party to be enjoyed more
xEffect	PersonX breaks the deadlock	yelled at
xEffect	PersonX takes the kids	cook food
xEffect	PersonX works within the framework	obeys the rules
xEffect	PersonX plays tennis with PersonY's friend	gains friend
xEffect	PersonX makes PersonY experiment	is thanked
xEffect	PersonX updates every ___	checks on the last update
xEffect	PersonX earns PersonY's bread	consumes energy
xEffect	PersonX leaves PersonY's mom	yelled at
xEffect	PersonX makes PersonY inventory	makes mistake
xEffect	PersonX is in good shape	eats healthy
xEffect	PersonX buys new shoes	has less money
xEffect	PersonX says would send	take time to send.
xEffect	PersonX checks PersonY's car	to cheks car
xEffect	PersonX thinks it was cute	sensitive
xEffect	PersonX is on the baseball team	Person x plays baseball
xEffect	PersonX sticks PersonX's neck out	gets hurt
xEffect	PersonX uses ___ to control	gets assassinated
xEffect	PersonX takes ___ off work	NONE
xEffect	PersonX gives PersonY a shove	is shoved back
xEffect	PersonX goes limp as PersonY smiled	Rolls eyes
xEffect	PersonX completes PersonX's workout	tired
xEffect	PersonX carries on PersonY's work	to have it fun
xEffect	PersonX is working fine	NONE
xEffect	PersonX imposes PersonX's ___ on others	are sued for unfair treatment
xEffect	PersonX is unable to walk	has pain
xEffect	PersonX drinks beer	burps
xEffect	PersonX follows the doctor 's advice	gets better
xEffect	PersonX pleases every ___	makes friends
xEffect	PersonX is going on a date	brushes teeth
xEffect	PersonX turns around to face PersonY	PersonX can see PersonY
xEffect	PersonX provides PersonY service	earns pay
xEffect	PersonX sends ___ outside	watched them
xEffect	PersonX takes PersonY's daughter	marries PersonY's daughter
xEffect	PersonX fills the ___ completely	gets messy
xEffect	PersonX grabs one	sad
xEffect	PersonX gives PersonY the address	Feels Rewarded
xEffect	PersonX buys a sandwich	gets full
xEffect	PersonX comes along with PersonY	intrudes
xEffect	PersonX nails the interview	gets complimented
xEffect	PersonX spends ___ away	Gradually loses touch
xEffect	PersonX makes some tea	smiles
xEffect	PersonX spends the whole time	went home lately
xEffect	PersonX sees what 's wrong	Reconsiders his marriage
xEffect	PersonX finds ___ in the world	lives a full life
xEffect	PersonX affects people 's ___	is taken care of
xEffect	PersonX keeps up PersonY's spirits	receives thanks
xEffect	PersonX leaves the office	thinks about his day at work
xEffect	PersonX learns ___ by heart	remembers
xEffect	PersonX loves PersonX's car	drives more than necessary
xEffect	PersonX spends some quality time	body stops aching
xEffect	PersonX gets PersonY's friends	hears his name shouted
xEffect	PersonX regains PersonX's position	gets praised
xEffect	PersonX slams on the breaks	gets hit by an airbag
xEffect	PersonX looks into PersonY eyes	confronts PersonY
xEffect	PersonX carries the ___ along	is burdened
xEffect	PersonX drives the ___ back	Gets promoted
xEffect	PersonX misses ___ very much	cries
xEffect	PersonX would ever	felt down
xEffect	PersonX heads to work	Person X gets stuck in traffic.
xEffect	PersonX develops PersonX's potential	earns a high income
xEffect	PersonX calls ___ to repentance	He gets yelled at by atheists.
xEffect	PersonX finishes PersonY's work	they are thanked
xEffect	PersonX carries PersonX's ___ into effect	PersonX follows his instincts and opinions and impacts them
xEffect	PersonX gives ___ to PersonY's friends	they cry
xEffect	PersonX follows PersonY's father 's ___	person x gains knowledge
xEffect	PersonX feels more confident	becomes more motivated
xEffect	PersonX closes PersonX's windows	Turns on the air
xEffect	PersonX asks the librarian	is handed a book
xEffect	PersonX pushes PersonY's tongue	gets bit
xEffect	PersonX pays the piper	becomes broke
xEffect	PersonX passes PersonX's test	gets an A
xEffect	PersonX buys ___ at target	they cook it for dinner
xEffect	PersonX eats ___ in one	feels full
xEffect	PersonX keeps telling PersonY	is listened to
xEffect	PersonX ends the day	PersonX goes to bed
xEffect	PersonX reaches for PersonX's phone	checks social media
xEffect	PersonX calls ___ to the fact	makes a point
xEffect	PersonX plays a ___ in the production	nervousness
xEffect	PersonX finds a puppy	smiles
xEffect	PersonX is mowing PersonX's lawn	IN RACING
xEffect	PersonX sees what the noise was	Becomes more alert
xEffect	PersonX meets PersonY's sister	PersonX exchanges pleasantries
xEffect	PersonX sees ___ in the sky	they eyes blink
xEffect	PersonX leaves the ___ behind	remembers
xEffect	PersonX makes things right	maintains friendship
xEffect	PersonX opens the gift	Person x walks to throw away wrapping paper
xEffect	PersonX reads a magazine	is testing out a new recipe from the magazine
xEffect	PersonX joins the track team	starts training
xEffect	PersonX considers every ___	is prepared
xEffect	PersonX tries to quit on PersonX's own	Gets rejected
xEffect	PersonX brings home to PersonY	PersonX gets appreciated
xEffect	PersonX has a huge crush on PersonY	person x puts on deodorant before seeing person y
xEffect	PersonX buys a bike	GETS EXERCISE
xEffect	PersonX develops PersonY understanding	learns things too
xEffect	PersonX needs a ride	asks for a ride
xEffect	PersonX loses PersonX's place	Will need a new place
xEffect	PersonX holds PersonX's liquor	admitted hospital
xEffect	PersonX keeps PersonX's temper	calms down
xEffect	PersonX commands thee this ___	is feared
xEffect	PersonX spends ___ learning	earns the skills
xEffect	PersonX works properly	sense of pride
xEffect	PersonX has a bone to pick	gets nervous
xEffect	PersonX tells PersonY had died	starts crying
xEffect	PersonX applies for college	happy
xEffect	PersonX makes ___ yesterday	cleaned dishes
xEffect	PersonX knows 's talking	moving people towards
xEffect	PersonX purchases one	gets a collectible.
xEffect	PersonX decorates PersonX's home	PersonX gets tired
xEffect	PersonX is cooking spaghetti	eat supper
xEffect	PersonX looks weird	gets comments
xEffect	PersonX tries yoga	stays calm
xEffect	PersonX misses the test	losts something
xEffect	PersonX goes back to PersonY	gets a lecture
xEffect	PersonX puts the fire out	burns himself
xEffect	PersonX falls sick	sneezes
xEffect	PersonX tries to run away	personx tries to move on
xEffect	PersonX thanks the ___ for support	they help him more
xEffect	PersonX becomes very close	gets arrested
xEffect	PersonX cleans PersonY's house	sneezes from dust
xEffect	PersonX comes close to PersonY	Tiptoes
xEffect	PersonX calls ___ to the need	is trusted
xEffect	PersonX drops the gloves	gets cold.
xEffect	PersonX gets a headache	PersonX is ill
xEffect	PersonX brings everyone	offers drinks to everyone
xEffect	PersonX pays it back	TO BE RETURN
xEffect	PersonX rolls out the red carpet	serves food
xEffect	PersonX casts PersonY's line	snags the line
xEffect	PersonX loses some weight	They fit into their clothes better
xEffect	PersonX sees ___ on television	Watches screen
xEffect	PersonX buys ___ for PersonX's son	provides
xEffect	PersonX rushes to the doctors	personX receives a bill
xEffect	PersonX recently met ___	PersonX imagines a date with the woman from tinder
xEffect	PersonX learns to cook	He knows how to cook
xEffect	PersonX infringes upon the rights	freedom
xEffect	PersonX becomes suspicious	wants to ask what happens
xEffect	PersonX finds ___ to wear	PersonX is physically comfortable (warmer/cooler)
xEffect	PersonX sweeps the floor	sneezes
xEffect	PersonX thinks twice	count their blessings
xEffect	PersonX gets ___ for my birthday	thanks the person
xEffect	PersonX surprises ___ with a trip	is thanked
xEffect	PersonX has a birthday coming up	Gets presents
xEffect	PersonX has to call in sick	spends the day feeling ill
xEffect	PersonX wants a new pair of shoes	Thinks about shoes
xEffect	PersonX accompanies PersonY far	- gets to know PersonY better
xEffect	PersonX draws forth ___	learns things from testimonies
xEffect	PersonX goes either ___	has two choices
xEffect	PersonX pursues PersonX's interest	Earns money
xEffect	PersonX eats cheeseburgers	PersonX gains satiation
xEffect	PersonX swims away	alone
xEffect	PersonX skates on thin ice	begins to breathe heavily
xEffect	PersonX carries PersonY back	wants to help
xEffect	PersonX wants to write a story	little work
xEffect	PersonX feels warm	takes a shower
xEffect	PersonX ties together the ___	has completed something
xEffect	PersonX wears a helmet	strap breaks
xEffect	PersonX sends ___ to take	X gets results
xEffect	PersonX makes ___ at school	continues going to school
xEffect	PersonX tells PersonY came	PersonX catches PersonY off guard
xEffect	PersonX turns on PersonX's heel	looks up
xEffect	PersonX orders PersonY back	gets listened to
xEffect	PersonX hears the ice cream truck	Grabs money
xEffect	PersonX carves a pumpkin	gets wet
xEffect	PersonX understands well the ___	rolls eyes
xEffect	PersonX puts ___ on PersonY's face	Pisses someone off
xEffect	PersonX gives PersonY the eye	his pupils get bigger
xEffect	PersonX tells PersonY was going on	is thanked
xEffect	PersonX is hiking in the woods	bitten by bugs
xEffect	PersonX makes ___ harder	loses weight
xEffect	PersonX invites PersonY to share	Gets an answer
xEffect	PersonX runs all the way	to runs all the way
xEffect	PersonX gets PersonX's hopes up	hopes it turns out well
xEffect	PersonX wills never forget	writes a book
xEffect	PersonX accepts another ___	has to give notice
xEffect	PersonX tilts PersonY's head	PersonY jolts away from PersonX
xEffect	PersonX decides to check it out	likes it and buys it
xEffect	PersonX visits PersonY's aunt	PersonX impresses PersonY
xEffect	PersonX reads PersonY's lips	gains knowledge about PersonY
xEffect	PersonX takes ___ together	knows the person better
xEffect	PersonX supports PersonY's views	gets counter arguments
xEffect	PersonX gets PersonX's wallet	thinks about how much money they have
xEffect	PersonX asks PersonY something	receives an answer
xEffect	PersonX gets ___ in the mail	opens mail
xEffect	PersonX comes ___ to find	sleeps
xEffect	PersonX places PersonY on the table	then do what he want
xEffect	PersonX fixes the roof	No longer gets wet
xEffect	PersonX runs smoothly	legs grow tired
xEffect	PersonX moves to california	becomes lost frequently
xEffect	PersonX continues PersonX's course	study well
xEffect	PersonX sounds interesting	PersonX is charismatic
xEffect	PersonX reads aloud a ___	learns more
xEffect	PersonX browses PersonY's collection	Person X found some important datas
xEffect	PersonX really needed ___	seek out needed item
xEffect	PersonX wears too many hats	looks odd
xEffect	PersonX meets new people	gets new friends
xEffect	PersonX heads to school	gets abducted
xEffect	PersonX enjoys the music	goes home
xEffect	PersonX takes part in the study	gains more knowledge
xEffect	PersonX loves to dance	learns a lot about dancing
xEffect	PersonX lifts PersonY's ___ in air	Arms get tired
xEffect	PersonX talks to PersonX's parents	gets evicted from home
xEffect	PersonX eats the pizza	gains weight
xEffect	PersonX pulls PersonY ___ away	leaves
xEffect	PersonX changes PersonX's behavior	PersonX behaves better
xEffect	PersonX pays one 's ___	saves money
xEffect	PersonX pays PersonX's cable bill	PersonX still has cable
xEffect	PersonX tries to find it	developing patience
xEffect	PersonX tells PersonY to put	insists
xEffect	PersonX leaves PersonX's friends	texts friends
xEffect	PersonX gets the ring	sees a diamond
xEffect	PersonX avoids PersonY misunderstanding	sighs in relief
xEffect	PersonX helps PersonY's team win	goes to party
xEffect	PersonX plants a garden in PersonX's backyard	sweats from heat
xEffect	PersonX shows PersonX's appreciation	smiles
xEffect	PersonX makes breakfast for PersonX's family	They clear the dishes afterwards
xEffect	PersonX costs a lot of money	loses money
xEffect	PersonX wants to talk	dials the number of his friend
xEffect	PersonX makes popcorn on the stove	eaten by guest
xEffect	PersonX spends every ___	smiles from buying new things
xEffect	PersonX takes the garbage out	has more room in kitchen
xEffect	PersonX reads an article	Person X thinks about the implications of what they read.
xEffect	PersonX buys school supplies	is prepared for class
xEffect	PersonX wants to see PersonY	picks them up
xEffect	PersonX sees many people	Stands in a crowd
xEffect	PersonX describes the ___ in terms	PersonX is animated
xEffect	PersonX helps PersonY's study	PersonX mentors PersonY
xEffect	PersonX waits PersonX's turn	grinds teeth in annoyance
xEffect	PersonX makes waffles	salivates
xEffect	PersonX punches PersonY in the face	Punished
xEffect	PersonX walks toward the door	get fresh air
xEffect	PersonX is still alone	sits
xEffect	PersonX makes PersonY attack	injured severly
xEffect	PersonX plays tennis with PersonY's friend	Makes new friends
xEffect	PersonX tells PersonY were going	Packs
xEffect	PersonX is riding PersonY's bike home from school	GETS INJUIRE
xEffect	PersonX is a bus driver	ponders how to keep riders safe
xEffect	PersonX names PersonY's lily	gets gratitude
xEffect	PersonX gets ___ as well	accumulates more things
xEffect	PersonX delivers pizzas	gets chased by dogs
xEffect	PersonX plies PersonY's trade	Changes dance partner
xEffect	PersonX makes money	Person X gets robbed
xEffect	PersonX cooks PersonX's food	gets burned
xEffect	PersonX does n't want anyone to know	gets caught
xEffect	PersonX gets new shoes	gets blister
xEffect	PersonX creates another ___	PersonX leads the advent into producing another government
xEffect	PersonX eats ___ in one	holds stomach due to pain
xEffect	PersonX sees a psychologist	Needs help
xEffect	PersonX submits PersonX's ___ to arbitration	Receives judgement
xEffect	PersonX starts the day	rides the bus
xEffect	PersonX produces PersonY result	praised
xEffect	PersonX makes PersonY appropriation	Talks to PersonY
xEffect	PersonX gets hired	gets training
xEffect	PersonX tosses the ball	has empty hand
xEffect	PersonX bets PersonX's boots	smiles
xEffect	PersonX executes every ___	Gets arrested
xEffect	PersonX sees PersonY example	is asked to repeat the behavior
xEffect	PersonX never use ___	has a nice reputation
xEffect	PersonX attends a wine tasting	is paid for his services by the organisation.
xEffect	PersonX goes everywhere	becomes open minded
xEffect	PersonX works toward goals	receives compliments and accolades
xEffect	PersonX attends PersonY's funeral	remembers time spent with person Y
xEffect	PersonX gets closer and closer	Climaxes
xEffect	PersonX becomes terrified	afraid
xEffect	PersonX chases PersonY away	PersonX becomes a hermit
xEffect	PersonX breaks PersonY's nose	get arrested for physical violence
xEffect	PersonX goes back home	is fed food
xEffect	PersonX jumps higher	becomes proud of himself
xEffect	PersonX breathes PersonX's last	struggles to live
xEffect	PersonX takes the bus	sits next to a sick person
xEffect	PersonX puts PersonY on the table	gets peed on
xEffect	PersonX asks a girl out	gets rejected
xEffect	PersonX sticks to PersonX's guns	PersonX won't comply
xEffect	PersonX follows PersonY everywhere	has a restraining order taken out against them
xEffect	PersonX makes the track team	PersonX smiles with joy
xEffect	PersonX finds the source of the smell	vomits
xEffect	PersonX rolls onto PersonY's back	TO BE FRANKED
xEffect	PersonX leaves the casino	they are richer
xEffect	PersonX arrives in class	goes in wrong room
xEffect	PersonX gives hostage to fortune	are watched carefully by law enforcement
xEffect	PersonX serves PersonX's interests	person x eats
xEffect	PersonX makes it rain	Person X gets wet
xEffect	PersonX scores a goal	gets thanked
xEffect	PersonX hears PersonY words	intriqued
xEffect	PersonX rehearses PersonX's lines	PersonX focuses on the lines
xEffect	PersonX gets stitches	stops bleeding
xEffect	PersonX holds PersonY opinion	PersonX thinks deeply about PersonY's opinion
xEffect	PersonX tells PersonY to sit	thinks about what to do next
xEffect	PersonX sells PersonX's old one	gets a commission
xEffect	PersonX gets PersonX's moneys worth	SAVING
xEffect	PersonX opens PersonY's ___ wide	gets hit
xEffect	PersonX keeps PersonY in line	moves Person Y
xEffect	PersonX gets ___ next time	learns their lesson
xEffect	PersonX tries PersonX's ___ elsewhere	gives up
xEffect	PersonX becomes very nervous	sweats from nerves
xEffect	PersonX keeps the ___ in repair	gets called hero
xEffect	PersonX visits ___ this weekend	no effect
xEffect	PersonX has to get another one	frowns
xEffect	PersonX makes a call	waiting for reply
xEffect	PersonX is on a road trip	visits new areas
xEffect	PersonX gets ___ on the way home	looks in mirror
xEffect	PersonX gives ___ up for adoption	loses a child
xEffect	PersonX helps ___ in distress	to helps in distrees
xEffect	PersonX gives PersonY's mom ___	Is viewed as a giver
xEffect	PersonX pulls an all nighter	drinks coffee
xEffect	PersonX makes ___ for PersonX's friend	is thanked
xEffect	PersonX accepts without question	made look like a fool
xEffect	PersonX gets a shock	Person x is short of breath
xEffect	PersonX stands on ceremony	is watched by those attending
xEffect	PersonX cooks dinner for PersonY's family	completes task
xEffect	PersonX buys another one	regrets wasting money
xEffect	PersonX visits PersonX's uncle 's farm	sees animals
xEffect	PersonX invites all of PersonY's friends	is invited back by person Y's friends
xEffect	PersonX loses all of PersonY's money	worries about where to looks for it
xEffect	PersonX loses every ___	loses his girlfriend to another suitor
xEffect	PersonX checks PersonY's mailbox	sees a bill
xEffect	PersonX gets home	goes to bed
xEffect	PersonX finally saved ___	sighs from contentedness
xEffect	PersonX becomes anxious	sweats
xEffect	PersonX is an avid runner	gets a cramp
xEffect	PersonX picks PersonY's favorite	to favourite food in the morning
xEffect	PersonX reads ___ to the class	PersonX gains confidence
xEffect	PersonX fixes PersonY's wagon	gets better at skill
xEffect	PersonX is a big brother	is looked up to
xEffect	PersonX feels PersonX's pulse	is able to learn what different heartrate sounds feel like
xEffect	PersonX screams with delight	PersonX has an adrenaline rush
xEffect	PersonX tells PersonY anything	Learns to trust people
xEffect	PersonX is too good to be true	true always never fail
xEffect	PersonX spends all afternoon	Dozes off to sleep
xEffect	PersonX eats food	wipes food off hands
xEffect	PersonX gets some coffee	has a pastry
xEffect	PersonX goes alone	PersonX cries
xEffect	PersonX tastes ___ for every man	ASPIRE
xEffect	PersonX wears PersonY's glasses	gets a headache
xEffect	PersonX cuts ___ badly	gets stitches
xEffect	PersonX adapts to PersonY's environment	becomes more flexible
xEffect	PersonX loses one	gets chastised by someone
xEffect	PersonX uses PersonX's resources	makes the best with what they have
xEffect	PersonX loses ___ yesterday	thinks about the object
xEffect	PersonX makes mashed potatoes	hands get dirty
xEffect	PersonX helps PersonX's son	demonstrates
xEffect	PersonX gets out while the gettings good	PersonX is only concerned for themselves
xEffect	PersonX pulls PersonY's pants	they get the child's pants pulled up
xEffect	PersonX lets PersonY win	Challenges another competition
xEffect	PersonX buys a new phone	smiles
xEffect	PersonX stops in PersonY's tracks	Gets down
xEffect	PersonX enters a marathon	gets cheered on
xEffect	PersonX is really loud	loses their voice
xEffect	PersonX bellies up to the bar	becomes drunk
xEffect	PersonX keeps ___ of the number	becomes prepared
xEffect	PersonX gets married ___	changes legal status
xEffect	PersonX breaks god 's ___	goes to jail
xEffect	PersonX considers the ___ in relation	decided to make new priorities
xEffect	PersonX makes PersonY gesture	is ignored
xEffect	PersonX dunks a basketball	wins the game
xEffect	PersonX pulls a prank on PersonY	is told to see the dean
xEffect	PersonX is afraid of heights	breathes faster
xEffect	PersonX wants a new shirt	search in the online
xEffect	PersonX starts the fire	see's the flames
xEffect	PersonX tells tales out of school	person x remembers
xEffect	PersonX never gave	is encouraged to do more
xEffect	PersonX sees in PersonY life	asks PersonY questions
xEffect	PersonX makes PersonY commitment	dont drink alcohol
xEffect	PersonX plays a gig	sore mussels
xEffect	PersonX starts singing	gets booed off the stage
xEffect	PersonX improves PersonX's conditions	wants to have a better house
xEffect	PersonX takes ___ to the game	gets angry at his/her team for losing today
xEffect	PersonX takes ___ to the beach	get's fresh air
xEffect	PersonX is going to the beach	FEEL THE FRESH AIR
xEffect	PersonX moves through the gears	X fixes the machine
xEffect	PersonX graduates from school	gains a diploma
xEffect	PersonX gets the ___ under way	run into problems
xEffect	PersonX bets PersonX's bottom dollar	fear
xEffect	PersonX eliminates every ___	breathes easier
xEffect	PersonX gets PersonY's mom	PersonX gets help
xEffect	PersonX thinks it was cool	PersonX admires it
xEffect	PersonX decides to go see a movie	has to check the times
xEffect	PersonX drops the f-bomb	apologizes
xEffect	PersonX is riding PersonY's bike	puts the bike away
xEffect	PersonX goes to get married	gets lots of presents
xEffect	PersonX scratches PersonY's head	dandruff falls
xEffect	PersonX continues throughout life	Perseveres
xEffect	PersonX decides to save up	gets a savings account
xEffect	PersonX immediately bought	want's to play the game
xEffect	PersonX attends PersonY's funeral	cries
xEffect	PersonX knows PersonY would	got beatings
xEffect	PersonX trains very hard	improves stamina
xEffect	PersonX becomes a professional gamer	to make money
xEffect	PersonX opens PersonX's gift	they have a new toy
xEffect	PersonX asks PersonY to dine	rejceted
xEffect	PersonX sticks in the mud	cleans their shoes
xEffect	PersonX runs 5 miles	GETS EXERCISE
xEffect	PersonX rents a boat	goes boating
xEffect	PersonX answers the call	speaks
xEffect	PersonX breaks PersonY's glasses	gets yelled at
xEffect	PersonX becomes furious	PersonX beats somebody
xEffect	PersonX gets a hot dog	PersonX eats the hot dog
xEffect	PersonX walks without a limp	gets to work faster
xEffect	PersonX gets a good spot	smiles
xEffect	PersonX gets ___ out of the garage	gets dusty
xEffect	PersonX runs PersonX's ___ through PersonX's hair	has less loose hairs
xEffect	PersonX takes ___ to the animal shelter	is asked to pay a fee
xEffect	PersonX calls all PersonX's friends	gets his call rejected
xEffect	PersonX hits the ground hard	is in pain
xEffect	PersonX leaves the country	learns a new place
xEffect	PersonX builds PersonX's houses	Person X has a complete home.
xEffect	PersonX takes ___ to disney	Spends money
xEffect	PersonX takes the ___ back	feel happy
xEffect	PersonX asks PersonX's mom for help	waits
xEffect	PersonX travels to canada	They visit family/friends
xEffect	PersonX boards the boat	hangs on
xEffect	PersonX takes ___ apart	thinks about mechanical facts
xEffect	PersonX finishes the hike	gets applauded
xEffect	PersonX wins the case	gains money or a settlement
xEffect	PersonX pays PersonX's debts	raises their credit score
xEffect	PersonX thinks might go	on vacation
xEffect	PersonX fulfils PersonY's mission	accomplished
xEffect	PersonX brings the ___ to life	jumps in excitement
xEffect	PersonX drives PersonY's car on the highway	steps on the gas
xEffect	PersonX camps with friends	fishes
xEffect	PersonX takes PersonY to court	Person X hires an attorney.
xEffect	PersonX saves PersonY life	to do something like that
